movie_ID,director,top_actors
912649,Kelly Marcel,"Tom Hardy, Chiwetel Ejiofor, Juno Temple"
1034541,Damien Leone,"Lauren LaVera, David Howard Thornton, Samantha Scaffidi"
1184918,Chris Sanders,"Lupita Nyong'o, Pedro Pascal, Kit Connor"
1118031,Carles Torrens,"Francisco Ortiz, José María Yázpik, Berta Vázquez"
558449,Ridley Scott,"Paul Mescal, Denzel Washington, Pedro Pascal"
533535,Shawn Levy,"Ryan Reynolds, Hugh Jackman, Emma Corrin"
933260,Coralie Fargeat,"Demi Moore, Margaret Qualley, Dennis Quaid"
1124641,Roel Reiné,"Aaron Eckhart, Tim Roth, Abigail Breslin"
698687,Josh Cooley,"Chris Hemsworth, Brian Tyree Henry, Scarlett Johansson"
845781,Jake Kasdan,"Dwayne Johnson, Chris Evans, Lucy Liu"
791042,Adam Stern,"Cara Gee, Peter Mooney, Aaron Abrams"
945961,Fede Álvarez,"Cailee Spaeny, David Jonsson, Archie Renaux"
179387,Joel Lamangan,"Paolo Serrano, Joash Balejado, Marco Morales"
519182,Chris Renaud,"Steve Carell, Kristen Wiig, Will Ferrell"
1100782,Parker Finn,"Naomi Scott, Rosemarie DeWitt, Lukas Gage"
1051896,Benjamin Brewer,"Nicolas Cage, Jaeden Martell, Maxwell Jenkins"
1142518,Mélanie Laurent,"Lucas Bravo, Yvan Attal, Léa Luce Busato"
402431,Jon M. Chu,"Cynthia Erivo, Ariana Grande, Jeff Goldblum"
1116490,Randall Emmett,"John Travolta, Kristin Davis, Lukas Haas"
1041317,Aaron Huggett,"Michael Lake, Christopher Cordell, Sylvain Plasse"
1022789,Kelsey Mann,"Amy Poehler, Maya Hawke, Kensington Tallman"
335983,Ruben Fleischer,"Tom Hardy, Michelle Williams, Riz Ahmed"
1084736,Alexandre de La Patellière,"Pierre Niney, Bastien Bouillon, Anaïs Demoustier"
1196470,Frédéric Jardin,"Andreas Pietschmann, Émilie Dequenne, Lucas Ebel"
928480,David Henrie,"Mel Gibson, Mason Thames, Julian Lerner"
1014505,Naoyuki Ito,"Satoshi Hino, Yumi Hara, Masayuki Katou"
1100856,Serik Beyseu,"Arthur Beschastny, Maryana Spivak, Sofya Shidlovskaya"
1029235,E.L. Katz,"Samara Weaving, Vic Carmen Sonne, Katariina Unt"
580489,Andy Serkis,"Tom Hardy, Woody Harrelson, Michelle Williams"
98,Ridley Scott,"Russell Crowe, Joaquin Phoenix, Connie Nielsen"
1094974,Nick McKinless,"Scott Adkins, Alice Eve, Jack Parr"
976734,Pierre Morel,"Kate Beckinsale, Rupert Friend, Saffron Burrows"
1288998,Nicolás Onetti,"Agustin Olcese, Mario Alarcón, Carlos Portaluppi"
592831,Francis Ford Coppola,"Adam Driver, Giancarlo Esposito, Nathalie Emmanuel"
889737,Todd Phillips,"Joaquin Phoenix, Lady Gaga, Brendan Gleeson"
1331375,Michael S. Ojeda,"Oksana Orlan, Sebastián Carvajal, María del Rosario"
1241982,David G. Derrick Jr.,"Auliʻi Cravalho, Dwayne Johnson, Hualālai Chung"
1328814,Carlos Ayala,"Sarah McDonald, Breanna Rossi, Adela Perez"
1371727,Garth Jennings,"Matthew McConaughey, Tori Kelly, Nick Kroll"
1144962,Michael Su,"Tom Arnold, Tania Fox, Jolene Anderson"
1159311,Tensai Okamura,"Daiki Yamashita, Nobuhiko Okamoto, Yuki Kaji"
1287717,Hugo Cardozo,"Pablo Martínez, Lucas Caballero, Rafael Alfaro"
573435,Adil El Arbi,"Will Smith, Martin Lawrence, Vanessa Hudgens"
157336,Christopher Nolan,"Matthew McConaughey, Anne Hathaway, Michael Caine"
269509,Kim Burdon,"Stephen Fry, Hugh Laurie, Freddie Highmore"
917496,Tim Burton,"Michael Keaton, Winona Ryder, Catherine O'Hara"
1140648,Ian Hunt Duffy,"Millie Brady, Pollyanna McIntosh, Akshay Kumar"
420634,Damien Leone,"David Howard Thornton, Jenna Kanell, Samantha Scaffidi"
1063877,Adam Schindler,"Kelsey Asbille, Finn Wittrock, Daniel Francis"
978796,Colm McCarthy,"Sam Claflin, Antonia Thomas, Caréll Vincent Rhoden"
1125510,Galder Gaztelu-Urrutia,"Milena Smit, Hovik Keuchkerian, Natalia Tena"
1151949,Timo Tjahjanto,"Aurora Ribero, Hana Malasan, Andri Mashadi"
1010581,Domingo González,"Nicole Wallace, Gabriel Guevara, Marta Hazas"
827931,Hannah Macpherson,"Madison Bailey, Antonia Gentry, Griffin Gluck"
726139,Kim Tae-gon,"Lee Sun-kyun, Ju Ji-hoon, Kim Hee-won"
155,Christopher Nolan,"Christian Bale, Heath Ledger, Aaron Eckhart"
823219,Gints Zilbalodis,
957452,Rupert Sanders,"Bill Skarsgård, FKA twigs, Danny Huston"
1145491,Jamaal Burden,"Tito Ortiz, Cristiane Justino, Kelsey Johnson"
482600,Kim Moo-won,"Jeon Ji-hak, Choi Min-ho, Saki Mizumi"
1288575,Rudi Soedjarwo,"Christine Hakim, Adinia Wirasti, Fedi Nuril"
1139095,Spider One,"Krsy Fox, Jon Sklaroff, Elizabeth Phoenix Caro"
972614,Michael Keaton,"Michael Keaton, Al Pacino, Marcia Gay Harden"
1354627,Ian Vasquez,"Tom Kenny, Bill Fagerbakke, Rodger Bumpass"
616446,Max Barbakow,"Josh Brolin, Peter Dinklage, Glenn Close"
663712,Damien Leone,"David Howard Thornton, Lauren LaVera, Elliott Fullam"
947891,Megan Park,"Maisy Stella, Aubrey Plaza, Percy Hynes White"
639720,John Krasinski,"Cailey Fleming, Ryan Reynolds, John Krasinski"
1079091,Justin Baldoni,"Blake Lively, Justin Baldoni, Jenny Slate"
24428,Joss Whedon,"Robert Downey Jr., Chris Evans, Mark Ruffalo"
991610,Bobby Boermans,"Tarikh Janssen, Gijs Blom, Ortál Vriend"
748783,Mark Dindal,"Chris Pratt, Samuel L. Jackson, Hannah Waddingham"
1290287,Jerry Ciccoritti,"Lacey Chabert, Dustin Milligan, Craig Robinson"
823464,Adam Wingard,"Rebecca Hall, Brian Tyree Henry, Dan Stevens"
653346,Wes Ball,"Owen Teague, Freya Allan, Kevin Durand"
814889,Alexandre Aja,"Halle Berry, Anthony B. Jenkins, William Catlett"
1292359,Cathy Garcia-Sampana,"Kathryn Bernardo, Alden Richards, Joross Gamboa"
173705,Yasuaki Uegaki,"Rushia Santô, Rina Oka, Kyôko Sagami"
1147710,Kim Sung-han,"Ha Jung-woo, Yeo Jin-goo, Sung Dong-il"
637649,Guy Ritchie,"Jason Statham, Holt McCallany, Josh Hartnett"
1137205,Alan Scott Neal,"Jessica Belkin, Jeremy Sisto, Taylor Kowalski"
603692,Chad Stahelski,"Keanu Reeves, Donnie Yen, Bill Skarsgård"
1120911,Jason Reitman,"Gabriel LaBelle, Rachel Sennott, Cory Michael Smith"
1011985,Mike Mitchell,"Jack Black, Awkwafina, Viola Davis"
939243,Jeff Fowler,"Jim Carrey, Ben Schwartz, Keanu Reeves"
1156593,Domingo González,"Nicole Wallace, Gabriel Guevara, Marta Hazas"
1373893,Ismael Vazquez Nervión,"Jose Valero, Gregor Acuña-Pohl"
824003,Antonio Manetti,"Giacomo Gianniotti, Miriam Leone, Valerio Mastandrea"
783110,Ryoo Seung-wan,"Kim Hye-soo, Yum Jung-ah, Zo In-sung"
1141182,Lowell Dean,"Douglas Smith, Carrie-Anne Moss, Frank Grillo"
718821,Lee Isaac Chung,"Daisy Edgar-Jones, Glen Powell, Anthony Ramos"
1147400,Thomas Astruc,"Annouck Hautbois, Benjamin Bollen, Marie Nonnenmacher"
385687,Louis Leterrier,"Vin Diesel, Michelle Rodriguez, Tyrese Gibson"
940551,Benjamin Renner,"Kumail Nanjiani, Elizabeth Banks, Caspar Jennings"
1153291,Alex Bries,"Gabriel Ng, Carolina Herrera, Santiago Rodríguez"
786892,George Miller,"Anya Taylor-Joy, Chris Hemsworth, Tom Burke"
507241,J.J. Perry,"Dave Bautista, Sofia Boutella, Terry Crews"
1144911,Austin Peters,"Elizabeth Banks, Lewis Pullman, Michaela Jaé Rodriguez"
693134,Denis Villeneuve,"Timothée Chalamet, Zendaya, Rebecca Ferguson"
1152774,Inés París,"María Caballero, Morgan Blasco, Javier Butler"
588648,Jian-Ping Li,"Lucía Pérez, Mario Gas, Fernando Castro"
762441,Michael Sarnoski,"Lupita Nyong'o, Joseph Quinn, Alex Wolff"
259872,Jennifer Lyon Bell,"Wim van Damme, Floor Wyns"
820530,Naoyuki Tatsuwa,"Hiroki Takahashi, Yuki Ono, Kohsuke Toriumi"
1160018,Nikhil Nagesh Bhat,"Lakshya Lalwani, Raghav Juyal, Tanya Maniktala"
1064028,SK Dale,"Megan Fox, Michele Morrone, Madeline Zima"
1329336,Kevin Peaty,"Michael Godere, Ezekiel Ajeigbe, Raul Ceballos"
1255208,David Andrew James,"John Wells, Madison Pullins, Patrick Taft"
1079485,Rhys Frake-Waterfield,"Scott Chambers, Ryan Oliva, Marcus Massey"
1087822,Brian Taylor,"Jack Kesy, Jefferson White, Adeline Rudolph"
1361292,Vaughn Stein,"Jordana Brewster, Scott Speedman, Laurence Fishburne"
365177,Eli Roth,"Cate Blanchett, Kevin Hart, Edgar Ramírez"
156022,Antoine Fuqua,"Denzel Washington, Marton Csokas, Chloë Grace Moretz"
1047373,Brad Anderson,"Joel Kinnaman, Sandra Mae Frank, Mekhi Phifer"
974950,Jacques Audiard,"Karla Sofía Gascón, Zoe Saldaña, Selena Gomez"
1249532,Ryan Coonan,"Michael Biehn, Tess Haubrich, Aaron Pedersen"
634649,Jon Watts,"Tom Holland, Zendaya, Benedict Cumberbatch"
667538,Steven Caple Jr.,"Anthony Ramos, Dominique Fishback, Peter Cullen"
671,Chris Columbus,"Daniel Radcliffe, Rupert Grint, Emma Watson"
464026,Sin Jeong-gyoon,"Sung Eun-chae, Jang Sung-won, Woo Do-hwan"
1138194,Scott Beck,"Hugh Grant, Sophie Thatcher, Chloe East"
18183,Alfonso Arau,"Lumi Cavazos, Regina Torné, Ada Carrasco"
1114513,James Watkins,"James McAvoy, Mackenzie Davis, Scoot McNairy"
299536,Joe Russo,"Robert Downey Jr., Chris Evans, Chris Hemsworth"
1066262,Lee Tamahori,"Guy Pearce, Tioreore Ngatai-Melbourne, Antonio Te Maioha"
1337309,Kongkiat Khomsiri,"Sukollawat Kanarot, Atitaya Tribudarak, Sanya Kunakorn"
3933,Mike Johnson,"Johnny Depp, Helena Bonham Carter, Emily Watson"
243352,Chris Dowling,"Danica McKellar, William Zabka, Kerr Smith"
1139566,Marçal Forés,"Clara Galle, Julio Peña, Natalia Azahara"
1357459,Jojo Nadela,"Mariane Saint, Marlon Marcia, Skye Gonzaga"
929590,Alex Garland,"Kirsten Dunst, Wagner Moura, Cailee Spaeny"
1215162,Valeri Milev,"Jean-Claude Van Damme, Jacqueline Fernandez, Andrei Lenart"
877817,Jon Watts,"George Clooney, Brad Pitt, Austin Abrams"
882598,Parker Finn,"Sosie Bacon, Kyle Gallner, Jessie T. Usher"
831815,Liza Johnson,"Carolyn Lawrence, Tom Kenny, Clancy Brown"
1306764,Carlo Ledesma,"Sid Lucero, Beauty Gonzalez, Marco Masa"
438631,Denis Villeneuve,"Timothée Chalamet, Rebecca Ferguson, Oscar Isaac"
829557,Barbara Białowąs,"Anna-Maria Sieklucka, Michele Morrone, Simone Susinna"
354912,Lee Unkrich,"Anthony Gonzalez, Gael García Bernal, Benjamin Bratt"
569094,Justin K. Thompson,"Shameik Moore, Hailee Steinfeld, Brian Tyree Henry"
238,Francis Ford Coppola,"Marlon Brando, Al Pacino, James Caan"
1089123,Benjamin Barfoot,"Julia Brown, Nathaniel Martello-White, Charles Aitken"
177572,Chris Williams,"Scott Adsit, Ryan Potter, Daniel Henney"
1217134,,"Christian Villete, Beverly Benny"
826510,Carlos Saldanha,"Zachary Levi, Lil Rel Howery, Zooey Deschanel"
278,Frank Darabont,"Tim Robbins, Morgan Freeman, Bob Gunton"
323260,Amen Au Cheuk-Man,"Dominic Ho, Candy Yuen, Jeana Ho Pui-Yu"
86328,Damien Leone,"Marie Maser, Mike Giannelli, Michael Chmiel"
1059264,Jérémie Degruson,"Monica Young, Danny Fehsenfeld, Olivier Paris"
587727,Junsei,"Yoo Jung, Kang Min-sik, Kim Wan- jin"
1104844,Shunsuke Ishikawa,"Nobunaga Shimazaki, Yuma Uchida, Kazuyuki Okitsu"
923667,Soi Cheang,"Raymond Lam Fung, Louis Koo, Terrance Lau"
974262,Jennifer Phang,"Kylie Cantrall, Malia Baker, Ruby Rose Turner"
1226578,Osgood Perkins,"Maika Monroe, Nicolas Cage, Blair Underwood"
16869,Quentin Tarantino,"Brad Pitt, Mélanie Laurent, Christoph Waltz"
414906,Matt Reeves,"Robert Pattinson, Zoë Kravitz, Jeffrey Wright"
420818,Jon Favreau,"Chiwetel Ejiofor, John Oliver, Donald Glover"
324786,Mel Gibson,"Andrew Garfield, Sam Worthington, Vince Vaughn"
1154215,Florent-Emilio Siri,"Roschdy Zem, Laëtitia Eïdo, Nabil Elouahabi"
1359227,Ken Cunningham,"Will Friedle, Kevin Smith, John Stamos"
16219,Rowdy Herrington,"James Marshall, T.E. Russell, Cuba Gooding Jr."
166426,Espen Sandberg,"Johnny Depp, Javier Bardem, Geoffrey Rush"
158011,Brad Anderson,"Halle Berry, Abigail Breslin, Morris Chestnut"
62835,Olivier Megaton,"Zoe Saldaña, Cliff Curtis, Callum Blue"
603,Lana Wachowski,"Keanu Reeves, Laurence Fishburne, Carrie-Anne Moss"
337167,James Foley,"Dakota Johnson, Jamie Dornan, Eric Johnson"
975022,Jerren Lauder,"McKaley Miller, Dermot Mulroney, Anne Heche"
597,James Cameron,"Leonardo DiCaprio, Kate Winslet, Billy Zane"
269149,Byron Howard,"Jason Bateman, Ginnifer Goodwin, Idris Elba"
1579,Mel Gibson,"Rudy Youngblood, Raoul Max Trujillo, Gerardo Taracena"
931944,Veronika Franz,"Anja Plaschg, Maria Hofstätter, David Scheid"
1154864,Carlos Marbán,"Daniela Casas, Noah Casas, Roxana Visan"
929563,Anna O'Brian,"Chris Houghton, Marieve Herington, Bob Joles"
166428,Dean DeBlois,"Jay Baruchel, America Ferrera, F. Murray Abraham"
260346,Olivier Megaton,"Liam Neeson, Forest Whitaker, Maggie Grace"
244786,Damien Chazelle,"Miles Teller, J.K. Simmons, Paul Reiser"
1233327,Karuna Kumar,"Varun Tej, Meenakshi Chaudhary, Nora Fatehi"
1280655,Alyssa Toledo,"Drew Starkey, Rudy Pankow, Elaine Siemek"
361743,Joseph Kosinski,"Tom Cruise, Miles Teller, Monica Barbaro"
840705,Zoë Kravitz,"Naomi Ackie, Channing Tatum, Alia Shawkat"
1139817,Jason Kim,"Kim Woo-bin, Kim Sung-kyun, Lee Hyun-gul"
787699,Paul King,"Timothée Chalamet, Calah Lane, Keegan-Michael Key"
567811,Christopher Jenkins,"Mo Gilligan, Simone Ashley, Sophie Okonedo"
245891,Chad Stahelski,"Keanu Reeves, Michael Nyqvist, Alfie Allen"
330457,Jennifer Lee,"Kristen Bell, Idina Menzel, Josh Gad"
231001,Damien Leone,"Katie Maguire, Catherine A. Callahan, Marie Maser"
335984,Denis Villeneuve,"Ryan Gosling, Harrison Ford, Ana de Armas"
8871,Ron Howard,"Jim Carrey, Taylor Momsen, Jeffrey Tambor"
1631,Catherine Breillat,"Charlotte Alexandra, Hiram Keller, Rita Maiden"
1210794,Jon Holmberg,"Filip Berg, Amy Deasismont, Joakim Sällquist"
120,Peter Jackson,"Elijah Wood, Ian McKellen, Viggo Mortensen"
1182047,Ali Abbasi,"Sebastian Stan, Jeremy Strong, Maria Bakalova"
122,Peter Jackson,"Elijah Wood, Ian McKellen, Viggo Mortensen"
11544,Chris Sanders,"Daveigh Chase, Chris Sanders, Tia Carrere"
198663,Wes Ball,"Dylan O'Brien, Kaya Scodelario, Aml Ameen"
15255,Isaac Florentine,"Michael Jai White, Scott Adkins, Ben Cross"
1140168,Ben J. Williams,"Danielle Scott, Lauren Budd, Matthew Baunsgard"
575264,Christopher McQuarrie,"Tom Cruise, Hayley Atwell, Ving Rhames"
2454,Andrew Adamson,"William Moseley, Anna Popplewell, Skandar Keynes"
76600,James Cameron,"Sam Worthington, Zoe Saldaña, Sigourney Weaver"
916192,Tomohisa Taguchi,"Ouji Suzuka, Marie Iitoyo, Tasuku Hatanaka"
360920,Yarrow Cheney,"Benedict Cumberbatch, Rashida Jones, Kenan Thompson"
168259,James Wan,"Vin Diesel, Paul Walker, Jason Statham"
9479,Henry Selick,"Danny Elfman, Chris Sarandon, Catherine O'Hara"
1022796,Fawn Veerasunthorn,"Ariana DeBose, Chris Pine, Alan Tudyk"
1025596,Rod Blackhurst,"Scoot McNairy, Kit Harington, Josh Lucas"
1147416,Thomas Astruc,"Annouck Hautbois, Benjamin Bollen, Marie Nonnenmacher"
672,Chris Columbus,"Daniel Radcliffe, Rupert Grint, Emma Watson"
808,Andrew Adamson,"Mike Myers, Eddie Murphy, Cameron Diaz"
423108,Michael Chaves,"Patrick Wilson, Vera Farmiga, Ruairí O'Connor"
1151534,Albert Pintó,"Anna Castillo, Tamar Novas, Irina Bravo"
324857,Bob Persichetti,"Shameik Moore, Jake Johnson, Hailee Steinfeld"
1279837,Petersen Vargas,"Joshua Garcia, Julia Barretto, Nonie Buencamino"
772,Chris Columbus,"Macaulay Culkin, Joe Pesci, Daniel Stern"
1064213,Sean Baker,"Mikey Madison, Mark Eydelshteyn, Yura Borisov"
4232,Wes Craven,"David Arquette, Neve Campbell, Courteney Cox"
150540,Pete Docter,"Amy Poehler, Phyllis Smith, Richard Kind"
1048241,Peter Segal,"Dave Bautista, Chloe Coleman, Kristen Schaal"
949484,Isaac Florentine,"Frank Grillo, Robert Patrick, Rhona Mitra"
254128,Brad Peyton,"Dwayne Johnson, Alexandra Daddario, Carla Gugino"
10191,Chris Sanders,"Jay Baruchel, Gerard Butler, Craig Ferguson"
14836,Henry Selick,"Dakota Fanning, Teri Hatcher, Jennifer Saunders"
216015,Sam Taylor-Johnson,"Dakota Johnson, Jamie Dornan, Jennifer Ehle"
704239,Julian Farino,"Mark Wahlberg, Halle Berry, J.K. Simmons"
843527,Michael Showalter,"Anne Hathaway, Nicholas Galitzine, Ella Rubin"
1134424,Jinanavin Veerapatra,"Ranee Campen, Tachaya Pathumwan, Sorawit Tongteng"
872585,Christopher Nolan,"Cillian Murphy, Emily Blunt, Matt Damon"
508947,Domee Shi,"Rosalie Chiang, Sandra Oh, Ava Morse"
1069387,Rodrigo Prieto,"Manuel Garcia-Rulfo, Tenoch Huerta Mejía, Dolores Heredia"
335977,James Mangold,"Harrison Ford, Phoebe Waller-Bridge, Mads Mikkelsen"
475557,Todd Phillips,"Joaquin Phoenix, Robert De Niro, Zazie Beetz"
799583,Guy Ritchie,"Henry Cavill, Eiza González, Alan Ritchson"
1122504,Erik Skybak,"Allegra Sweeney, Calvin Morie McCarthy, Neil Green"
348893,Todor Chapkanov,"Scott Adkins, Teodora Duhovnikova, Alon Aboutboul"
249397,Lars von Trier,"Charlotte Gainsbourg, Stellan Skarsgård, Stacy Martin"
162,Tim Burton,"Johnny Depp, Winona Ryder, Dianne Wiest"
246655,Bryan Singer,"James McAvoy, Michael Fassbender, Jennifer Lawrence"
27205,Christopher Nolan,"Leonardo DiCaprio, Joseph Gordon-Levitt, Ken Watanabe"
673,Alfonso Cuarón,"Daniel Radcliffe, Rupert Grint, Emma Watson"
1029281,JT Mollner,"Willa Fitzgerald, Kyle Gallner, Madisen Beaty"
1358752,Nik Kacevski,
263472,Eli Roth,"Keanu Reeves, Lorenza Izzo, Ana de Armas"
675353,Jeff Fowler,"Ben Schwartz, James Marsden, Tika Sumpter"
72808,Marco Ferreri,"Sergio Castellitto, Francesca Dellera, Philippe Léotard"
1152624,Louis Mandylor,"Louis Mandylor, Donald Cerrone, Quinton 'Rampage' Jackson"
1159518,Philippe Martinez,"Jackson Rathbone, Alex Pettyfer, Eve Mauro"
22,Gore Verbinski,"Johnny Depp, Orlando Bloom, Keira Knightley"
114,Garry Marshall,"Richard Gere, Julia Roberts, Jason Alexander"
109445,Chris Buck,"Kristen Bell, Idina Menzel, Jonathan Groff"
259693,James Wan,"Patrick Wilson, Vera Farmiga, Madison Wolfe"
601796,Choi Dong-hoon,"Ryu Jun-yeol, Kim Woo-bin, Kim Tae-ri"
976573,Peter Sohn,"Leah Lewis, Mamoudou Athie, Ronnie del Carmen"
674,Mike Newell,"Daniel Radcliffe, Rupert Grint, Emma Watson"
1094138,Paul Feig,"Awkwafina, John Cena, Simu Liu"
746036,David Leitch,"Ryan Gosling, Emily Blunt, Aaron Taylor-Johnson"
1585,Frank Capra,"James Stewart, Donna Reed, Lionel Barrymore"
396535,Yeon Sang-ho,"Gong Yoo, Kim Su-an, Jung Yu-mi"
170,Danny Boyle,"Cillian Murphy, Naomie Harris, Brendan Gleeson"
1181068,Hanung Bramantyo,"Michelle Ziudith, Deva Mahenra, Davina Karamoy"
1219529,Leticia Tonos,"Paz Vega, Jalsen Santana, Sophie Gómez"
335988,Michael Bay,"Mark Wahlberg, Laura Haddock, Peter Cullen"
259316,David Yates,"Eddie Redmayne, Katherine Waterston, Dan Fogler"
247136,Tadashi Kyouya,"Elly Akira, Risa Sakamoto, Mika Muroi"
299054,Scott Waugh,"Jason Statham, 50 Cent, Megan Fox"
609681,Nia DaCosta,"Brie Larson, Teyonah Parris, Iman Vellani"
508883,Hayao Miyazaki,"Soma Santoki, Masaki Suda, Ko Shibasaki"
1136318,Callum Burn,"Arnold Voysey, Vin Hawke, Hannah Harris"
496243,Bong Joon-ho,"Song Kang-ho, Lee Sun-kyun, Cho Yeo-jeong"
27066,Tinto Brass,"Katarina Vasilissa, Francesco Casale, Cristina Garavaglia"
5255,Robert Zemeckis,"Tom Hanks, Leslie Zemeckis, Eddie Deezen"
1734,Stephen Sommers,"Brendan Fraser, Rachel Weisz, John Hannah"
424,Steven Spielberg,"Liam Neeson, Ben Kingsley, Ralph Fiennes"
122917,Peter Jackson,"Ian McKellen, Martin Freeman, Richard Armitage"
293660,Tim Miller,"Ryan Reynolds, Morena Baccarin, Ed Skrein"
1219685,Hélène Fillières,"Laurent Gerra, Eddy Mitchell, Laure-Lucille Simon"
12445,David Yates,"Daniel Radcliffe, Emma Watson, Rupert Grint"
329505,Bruno Gaburro,"Donatella Damiani, Scott Coffey, Gabriele Tinti"
1865,Rob Marshall,"Johnny Depp, Penélope Cruz, Geoffrey Rush"
1581,Nancy Meyers,"Cameron Diaz, Kate Winslet, Jude Law"
1001311,Xavier Gens,"Bérénice Bejo, Nassim Lyes, Léa Léviant"
260514,Brian Fee,"Owen Wilson, Cristela Alonzo, Chris Cooper"
4247,Keenen Ivory Wayans,"Anna Faris, Jon Abrahams, Marlon Wayans"
1241748,Artemio Abad,"Van Allen Ong, Sheila Snow, Arah Alonzo"
256591,John Requa,"Will Smith, Margot Robbie, Rodrigo Santoro"
271110,Joe Russo,"Chris Evans, Robert Downey Jr., Scarlett Johansson"
866398,David Ayer,"Jason Statham, Emmy Raver-Lampman, Josh Hutcherson"
18785,Todd Phillips,"Bradley Cooper, Ed Helms, Zach Galifianakis"
1143019,Frédéric Forestier,"Inès Reg, Kévin Debonne, Vincent Rottiers"
1264429,Inarah Syarafina,"Yasamin Jasem, Bryan Domani, Karina Suwandi"
263115,James Mangold,"Hugh Jackman, Dafne Keen, Patrick Stewart"
829560,Barbara Białowąs,"Anna-Maria Sieklucka, Michele Morrone, Simone Susinna"
1188808,G.B. Sampedro,"Arron Villaflor, Apple Dy, Joko Diaz"
585,Pete Docter,"John Goodman, Billy Crystal, Mary Gibbs"
1291559,Takahiro Miki,"Ren Nagase, Natsuki Deguchi, Mayuu Yokota"
299534,Anthony Russo,"Robert Downey Jr., Chris Evans, Mark Ruffalo"
447365,James Gunn,"Chris Pratt, Zoe Saldaña, Dave Bautista"
1108427,Thomas Kail,"Catherine Laga'Aia, Dwayne Johnson, Rena Owen"
176,James Wan,"Cary Elwes, Leigh Whannell, Danny Glover"
157350,Neil Burger,"Shailene Woodley, Theo James, Zoë Kravitz"
568124,Byron Howard,"Stephanie Beatriz, María Cecilia Botero, John Leguizamo"
106646,Martin Scorsese,"Leonardo DiCaprio, Jonah Hill, Margot Robbie"
58,Gore Verbinski,"Johnny Depp, Orlando Bloom, Keira Knightley"
748230,Gary Dauberman,"Lewis Pullman, Makenzie Leigh, Jordan Preston Carter"
1186947,João Wainer,"Maria Bomani, Jean Amorim, Milhem Cortaz"
17979,Robert Zemeckis,"Jim Carrey, Gary Oldman, Colin Firth"
1011397,Ross MacGibbon,"Francesca Hayward, Laura Morera, Mayara Magri"
1308546,Justin Harding,"Peyton Elizabeth Lee, Corey Fogelmanis, Carla Jimenez"
1209290,Jeff Wamester,"Jensen Ackles, Darren Criss, Corey Stoll"
1096197,Claudio Fäh,"Colm Meaney, Phyllis Logan, Sophie McIntosh"
767,David Yates,"Daniel Radcliffe, Rupert Grint, Emma Watson"
1159477,Christian Sparkes,"Frances Fisher, Clayne Crawford, Lara Jean Chorostecki"
792307,Yorgos Lanthimos,"Emma Stone, Mark Ruffalo, Willem Dafoe"
370663,April Mullen,"Erika Linder, Natalie Krill, Sebastian Pigott"
1572,John McTiernan,"Bruce Willis, Samuel L. Jackson, Jeremy Irons"
18190,Nicholas Kazan,"James Spader, Mädchen Amick, Fredric Lehne"
1062215,Chris Weitz,"John Cho, Katherine Waterston, Keith Carradine"
675,David Yates,"Daniel Radcliffe, Rupert Grint, Emma Watson"
1207830,Kevin Donovan,"Claire Alan, Cory Doran, Susan Sarandon"
1150394,Marvick Núñez,"Benny Emmanuel, Emilio Treviño, Jorge Rafael"
257344,Chris Columbus,"Adam Sandler, Kevin James, Michelle Monaghan"
646097,Jeremy Saulnier,"Aaron Pierre, Don Johnson, AnnaSophia Robb"
1032823,M. Night Shyamalan,"Josh Hartnett, Ariel Donoghue, Saleka"
1029575,Simon Cellan Jones,"Mark Wahlberg, Michelle Monaghan, Maggie Q"
4011,Tim Burton,"Alec Baldwin, Geena Davis, Winona Ryder"
507089,Emma Tammi,"Josh Hutcherson, Piper Rubio, Elizabeth Lail"
348,Ridley Scott,"Tom Skerritt, Sigourney Weaver, Veronica Cartwright"
519465,May el-Toukhy,"Trine Dyrholm, Gustav Lindh, Magnus Krepper"
12444,David Yates,"Daniel Radcliffe, Emma Watson, Rupert Grint"
869291,Tilman Singer,"Hunter Schafer, Jan Bluthardt, Marton Csokas"
152601,Spike Jonze,"Joaquin Phoenix, Scarlett Johansson, Lynn Adrianna"
260513,Brad Bird,"Craig T. Nelson, Holly Hunter, Sarah Vowell"
338953,David Yates,"Eddie Redmayne, Jude Law, Mads Mikkelsen"
572802,James Wan,"Jason Momoa, Patrick Wilson, Yahya Abdul-Mateen II"
129,Hayao Miyazaki,"Rumi Hiiragi, Miyu Irino, Mari Natsuki"
161,Steven Soderbergh,"George Clooney, Matt Damon, Andy García"
176241,Kevin Hooks,"Wentworth Miller, Sarah Wayne Callies, Dominic Purcell"
8587,Roger Allers,"Matthew Broderick, Moira Kelly, Nathan Lane"
250546,John R. Leonetti,"Annabelle Wallis, Ward Horton, Tony Amendola"
11360,Ben Sharpsteen,"Edward Brophy, Margaret Wright, Verna Felton"
507086,Colin Trevorrow,"Chris Pratt, Bryce Dallas Howard, Laura Dern"
605722,Will Speck,"Anthony Ramos, Naomi Scott, Kristofer Hivju"
861035,Aik Karapetian,"Kevin Janssens, Laura Siliņa, Aigars Vilims"
763215,Juan Carlos Fresnadillo,"Millie Bobby Brown, Ray Winstone, Angela Bassett"
19995,James Cameron,"Sam Worthington, Zoe Saldaña, Sigourney Weaver"
447277,Rob Marshall,"Halle Bailey, Jonah Hauer-King, Melissa McCarthy"
11362,Kevin Reynolds,"Jim Caviezel, Guy Pearce, Richard Harris"
453395,Sam Raimi,"Benedict Cumberbatch, Xochitl Gomez, Elizabeth Olsen"
337404,Craig Gillespie,"Emma Stone, Emma Thompson, Joel Fry"
1158915,Sean Wang,"Izaac Wang, Joan Chen, Shirley Chen"
1320786,Damien Leone,"David Howard Thornton, Lauren LaVera"
175168,Naoyuki Tomomatsu,"Alice Ozawa, Asami, Yui Aikawa"
257211,Nancy Meyers,"Robert De Niro, Anne Hathaway, Rene Russo"
862,John Lasseter,"Tom Hanks, Tim Allen, Don Rickles"
131631,Francis Lawrence,"Jennifer Lawrence, Josh Hutcherson, Liam Hemsworth"
138843,James Wan,"Patrick Wilson, Vera Farmiga, Lili Taylor"
1111873,Tyler Gillett,"Melissa Barrera, Dan Stevens, Alisha Weir"
1190868,Jordan Downey,"Brian Baker, Trevor Dow, Gerry Eng"
11430,Bradley Raymond,"Nathan Lane, Ernie Sabella, Julie Kavner"
438148,Kyle Balda,"Steve Carell, Pierre Coffin, Alan Arkin"
11395,John Pasquin,"Tim Allen, Judge Reinhold, Wendy Crewson"
508442,Pete Docter,"Jamie Foxx, Tina Fey, Graham Norton"
339846,Seth Gordon,"Dwayne Johnson, Zac Efron, Priyanka Chopra Jonas"
336843,Wes Ball,"Dylan O'Brien, Kaya Scodelario, Thomas Brodie-Sangster"
38757,Byron Howard,"Mandy Moore, Zachary Levi, Donna Murphy"
934433,Matt Bettinelli-Olpin,"Melissa Barrera, Jenna Ortega, Jasmin Savoy Brown"
937278,Marc Forster,"Tom Hanks, Mariana Treviño, Cameron Britton"
1252428,Xiang Qiuliang,"Nita Xia, Terence Yin Chi-Wai, Wang Xingchen"
2062,Brad Bird,"Patton Oswalt, Ian Holm, Lou Romano"
184345,Michael Tiddes,"Marlon Wayans, Jaime Pressly, Essence Atkins"
901060,John Gulager,"Danny Trejo, Efren Ramirez, Maria Canals-Barrera"
1262983,David Moreau,"Lucille Guillaume, Laurie Pavy, Milton Riche"
1362961,Fernando Urdapilleta,"Silvia Navarro, Michelle Rodríguez, Mauricio Islas"
254470,Elizabeth Banks,"Anna Kendrick, Brittany Snow, Hailee Steinfeld"
934632,Zack Snyder,"Sofia Boutella, Michiel Huisman, Ed Skrein"
926393,Antoine Fuqua,"Denzel Washington, Dakota Fanning, Eugenio Mastrandrea"
1148172,Shashanka Chaturvedi,"Kriti Sanon, Kajol, Shaheer Sheikh"
1037113,Adam Rehmeier,"Conor Sherry, Gabriel LaBelle, Mika Abdalla"
557,Sam Raimi,"Tobey Maguire, Willem Dafoe, Kirsten Dunst"
252,Mel Stuart,"Gene Wilder, Peter Ostrum, Jack Albertson"
116149,Paul King,"Ben Whishaw, Hugh Bonneville, Sally Hawkins"
10625,Mark Waters,"Lindsay Lohan, Rachel McAdams, Lizzy Caplan"
359410,Doug Liman,"Jake Gyllenhaal, Billy Magnussen, Daniela Melchior"
539972,J.C. Chandor,"Aaron Taylor-Johnson, Ariana DeBose, Fred Hechinger"
566525,Destin Daniel Cretton,"Simu Liu, Tony Leung Chiu-Wai, Awkwafina"
