movie_ID,director,top_actors
10991,Kunihiko Yuyama,"Rica Matsumoto, Ikue Otani, Yuji Ueda"
785534,Can Ulkay,"Çağatay Ulusoy, Emir Ali Doğrul, Ersin Arıcı"
27274,Frank Henenlotter,"James Lorinz, Patty Mullen, Joseph Gonzalez"
480651,Cathy Garcia-Sampana,"Aga Muhlach, Dingdong Dantes, Enrique Gil"
1017204,Hiroyuki Yamashita,"Junko Takeuchi, Nana Mizuki, Yuko Sanpei"
844185,Jerry Seinfeld,"Jerry Seinfeld, Melissa McCarthy, Jim Gaffigan"
502416,Tate Taylor,"Octavia Spencer, Juliette Lewis, Diana Silvers"
557950,Gia Coppola,"Andrew Garfield, Maya Hawke, Nat Wolff"
446894,Karey Kirkpatrick,"Channing Tatum, James Corden, Zendaya"
23942,Stuart Gillard,"Willie Aames, Phoebe Cates, Tuvia Tavi"
758866,Ryūsuke Hamaguchi,"Hidetoshi Nishijima, Toko Miura, Masaki Okada"
249053,Mike Marzuk,"Valeria Eisenbart, Quirin Oettl, Justus Schlingensiepen"
18176,Brett Simon,"Reece Thompson, Mischa Barton, Bruce Willis"
253331,Mike Binder,"Kevin Costner, Jillian Estell, Jennifer Ehle"
15875,John Ford,"John Wayne, Elizabeth Allen, Lee Marvin"
670327,Hideki Araki,"Wataru Hatano, Takuma Terashima, Toshiyuki Morikawa"
11003,Frank Coraci,"Adam Sandler, Drew Barrymore, Christine Taylor"
15785,Steve De Jarnatt,"Melanie Griffith, David Andrews, Pamela Gidley"
795,Brad Silberling,"Nicolas Cage, Meg Ryan, Andre Braugher"
489999,Aneesh Chaganty,"John Cho, Michelle La, Debra Messing"
9587,Gillian Armstrong,"Winona Ryder, Trini Alvarado, Samantha Mathis"
101251,Damian Chapa,"Damian Chapa, Jeff McCredie, Konstantine Anton"
500682,John Lee Hancock,"Kevin Costner, Woody Harrelson, Kathy Bates"
1384148,Félix Germán,"Mozart La Para, Dalisa Alegría, Bárbaro Marín"
829410,John Hyams,"Gideon Adlon, Bethlehem Million, Dylan Sprayberry"
663260,Yann Gozlan,"Pierre Niney, Lou de Laâge, André Dussollier"
366672,Rob Minkoff,"Michael Cera, Samuel L. Jackson, Ricky Gervais"
160564,Agnès Jaoui,"Agnès Jaoui, Jean-Pierre Bacri, Agathe Bonitzer"
10956,Dennie Gordon,"David Spade, Dennis Miller, Brittany Daniel"
981347,Tyler-James,"Becca Hirani, Tara MacGowran, May Kelly"
9428,Wes Anderson,"Gene Hackman, Anjelica Huston, Ben Stiller"
928769,Stephan Zlotescu,"Mario Maurer, Pimchanok Luevisadpaibul, Michael S. New"
645788,Martin Campbell,"Maggie Q, Samuel L. Jackson, Michael Keaton"
256569,Adam Smith,"Michael Fassbender, Brendan Gleeson, Lyndsey Marshal"
184352,Xavier Dolan,"Xavier Dolan, Pierre-Yves Cardinal, Lise Roy"
287424,Henry Hobson,"Arnold Schwarzenegger, Abigail Breslin, Joely Richardson"
850025,Goce Cvetanovski,"Musa Isufi, Slagjana Vujošević, Ismail Kasumi"
806,John Moore,"Liev Schreiber, Julia Stiles, Mia Farrow"
9053,Corey Yuen,"Jaime Pressly, Holly Valance, Sarah Carter"
8843,Tarsem Singh,"Jennifer Lopez, Vince Vaughn, Vincent D'Onofrio"
1693,Michael Davis,"Eric Jungmann, Justin Urich, Aimee Brooks"
413998,Roger Michell,"Rachel Weisz, Sam Claflin, Holliday Grainger"
212161,Kazuki Akane,"Miyu Irino, Maaya Sakamoto, Satoshi Hino"
27273,Jules Bass,"Harry Morgan, James Gregory, John Ritter"
514690,Daniel Gilboy,"Michael Paré, Anna Barker, Marin Almasi"
604872,Simon West,"Wang Xueqi, Hannah Quinlivan, Shawn Dou"
27277,Burt Kennedy,"John Wayne, Kirk Douglas, Howard Keel"
9564,Claude Zidi,"Christian Clavier, Gérard Depardieu, Roberto Benigni"
657561,Ricard Cussó,"Miranda Tapsell, Ross Noble, Kate Murphy"
1207360,Kevin Greutert,"Tobin Bell, Costas Mandylor"
17027,Edward Anderson,"Tony Curran, Peyton List, Cameron Goodman"
333385,Paco Cabezas,"Sam Rockwell, Anna Kendrick, Tim Roth"
1015333,Paul Alexei Basinillo,"Janelle Tee, Ava Mendez, Raymond Bagatsing"
156711,Jerusha Hess,"Keri Russell, JJ Feild, Bret McKenzie"
9718,Adam McKay,"Will Ferrell, John C. Reilly, Michael Clarke Duncan"
9529,Bernard Rose,"Virginia Madsen, Tony Todd, Xander Berkeley"
138544,Darin Scott,"Alessandra Torresani, Morgan Fairchild, Salina Duplessis"
17186,Steve Boyum,"Steve Howey, Mike Vogel, Cameron Richardson"
15389,Whit Stillman,"Edward Clements, Chris Eigeman, Taylor Nichols"
317744,Elizabeth Allen Rosenbaum,"Nick Jonas, Isabel Lucas, Dermot Mulroney"
236735,Alberto Rodríguez,"Raúl Arévalo, Javier Gutiérrez, Antonio de la Torre"
629028,Kim Hyung-joo,"Kim Young-kwang, Lee Sun-bin, Oh Dae-hwan"
532973,Stephen Cognetti,"Vas Eli, Jillian Geurts, Joy Shatz"
25858,Akira Kurosawa,"Takashi Shimura, Toshirō Mifune, Reizaburo Yamamoto"
59902,Mark L. Lester,"Marjoe Gortner, Lynda Carter, Jesse Vint"
14138,David Nerlich,"Maeve Dermody, Diana Glenn, Andy Rodoreda"
366170,Satoshi Kuwabara,"Kenjiro Tsuda, Shunsuke Kazama, Hiroki Takahashi"
11599,Lou Ye,"Zhou Xun, Jia Hongsheng, Nai An"
10351,Robert Kurtzman,"Angus Scrimm, Andrew Divoff, Tammy Lauren"
1365,Marc Forster,"Billy Bob Thornton, Heath Ledger, Halle Berry"
98357,Allen Hughes,"Mark Wahlberg, Russell Crowe, Catherine Zeta-Jones"
1152306,Chris Huo,"Simon Yam, Andy On Chi-Kit, Yuen Wah"
27579,Anton Corbijn,"George Clooney, Violante Placido, Thekla Reuten"
26263,J. Lee Thompson,"Charles Bronson, Kay Lenz, John P. Ryan"
8836,Chris Carter,"David Duchovny, Gillian Anderson, Amanda Peet"
11963,Sydney Pollack,"Robert Redford, Faye Dunaway, Cliff Robertson"
15788,Jerry Lewis,"Jerry Lewis, Alex Gerry, Milton Berle"
8665,Kathryn Bigelow,"Harrison Ford, Liam Neeson, Peter Sarsgaard"
595586,Lila Neugebauer,"Jennifer Lawrence, Brian Tyree Henry, Linda Emond"
760868,Adam Berg,"Noomi Rapace, Jakob Oftebro, Dar Salim"
10155,Oliver Stone,"Sean Penn, Nick Nolte, Jennifer Lopez"
7092,Sharon Bridgeman,"Hugh Jackman, Robbie Coltrane, David Wenham"
401469,Steve McQueen,"Viola Davis, Michelle Rodriguez, Elizabeth Debicki"
20187,Clint Eastwood,"Clint Eastwood, George Kennedy, Vonetta McGee"
9816,Thomas Carter,"Julia Stiles, Sean Patrick Thomas, Kerry Washington"
10644,Philip Kaufman,"Daniel Day-Lewis, Juliette Binoche, Lena Olin"
24913,Fred Walton,"Amy Steel, Ken Olandt, Deborah Foreman"
13056,Lexi Alexander,"Ray Stevenson, Dominic West, Stephanie Janusauskas"
30959,Masaki Kobayashi,"Michiyo Aratama, Rentaro Mikuni, Misako Watanabe"
661791,Paco Plaza,"Almudena Amor, Vera Valdez, Karina Kolokolchykova"
8012,Barry Sonnenfeld,"John Travolta, Gene Hackman, Rene Russo"
599925,Vishnuvardhan,"Sidharth Malhotra, Kiara Advani, Shataf Figar"
437103,Jang Joon-hwan,"Kim Yun-seok, Ha Jung-woo, Yoo Hai-jin"
249260,Scott Wheeler,"Alexander Mendeluk, Kate Nauta, Benjamin Easterday"
393624,Gavin Hood,"Keira Knightley, Matt Smith, Ralph Fiennes"
252360,Uwe Boll,"Dominic Purcell, Ralitsa Paskaleva, Daria Simeonova"
524738,Timo Tjahjanto,"Chelsea Islan, Pevita Pearce, Karina Suwandi"
479957,Diego Kaplan,"Mónica Antonópulos, Guilherme Winter, Juan Sorini"
11848,Joy Batchelor,"Gordon Heath, Maurice Denham, Simon Cadell"
433498,Michael Noer,"Charlie Hunnam, Rami Malek, Christopher Fairbank"
429300,Baltasar Kormákur,"Shailene Woodley, Sam Claflin, Jeffrey Thomas"
351964,Will Slocombe,"Lyndsy Fonseca, Michael Doneger, Tommy Dewey"
548,Akira Kurosawa,"Toshirō Mifune, Machiko Kyō, Takashi Shimura"
1370609,Nattaporn Phetskaew,Nattaporn Phetskaew
264529,Ernesto Contreras,"Irene Azuela, José María Yázpik, Cecilia Suárez"
17684,Merzak Allouache,"Gad Elmaleh, Alain Chabat, Claude Brasseur"
84308,David Trueba,"José Sacristán, María Valverde, Ramon Fontserè"
938567,Hiroaki Akagi,"Yuki Kaji, Rie Takahashi, Inori Minase"
384682,Josh Gordon,"Jason Bateman, Olivia Munn, T.J. Miller"
10860,Herbert Ross,"Sally Field, Dolly Parton, Shirley MacLaine"
15363,Sanaa Hamri,"Sanaa Lathan, Simon Baker, Blair Underwood"
455236,Jesse V. Johnson,"Scott Adkins, Ray Stevenson, Ashley Greene"
333667,Ash Brannon,"Luke Wilson, Eddie Izzard, J.K. Simmons"
12627,Jacques Rivette,"Michel Piccoli, Emmanuelle Béart, Jane Birkin"
365942,Peter Chelsom,"Asa Butterfield, Britt Robertson, Carla Gugino"
11572,Pascal Pinon,"Kirsten Dunst, Cécile de France, Richard Harris"
991708,Pablo Larraín,"Jaime Vadell, Gloria Münchmeyer, Alfredo Castro"
25355,Olivier Assayas,"Maggie Cheung Man-Yuk, Jean-Pierre Léaud, Nathalie Richard"
16200,Steven R. Monroe,"Mimi Rogers, Robert Moloney, Andrew Airlie"
10015,Clint Eastwood,"Clint Eastwood, Marsha Mason, Everett McGill"
10297,Jean Negulesco,"Marilyn Monroe, Lauren Bacall, Betty Grable"
1377576,Daniel Skrip,"Marcos Oliveira, Jorge Júlio, Bella Oliveira"
681429,Agustín Oso Tapia,"Fernanda Castillo, Juan Ríos, Iván Arana"
898994,Ludovic Bernard,"Franck Dubosc, Aure Atika, Alexis Michalik"
803279,Hiroto Takahashi,"Ukisho Hidaka, Sei Shiraishi, Mizuki Itagaki"
554447,Choi Woo-seong,"Lee Soo, Ha Jin, Seo Won"
424998,Jon Gunn,"Mike Vogel, Erika Christensen, Faye Dunaway"
571265,Tomohisa Taguchi,"Natsuki Hanae, Mao Ichimichi, Suzuko Mimori"
25866,Gérard Oury,"Bourvil, Louis de Funès, Venantino Venantini"
267,Pedro Almodóvar,"Javier Bardem, Francesca Neri, Liberto Rabal"
489931,Bart Layton,"Evan Peters, Barry Keoghan, Blake Jenner"
173153,David Mamet,"Helen Mirren, Al Pacino, Jeffrey Tambor"
537061,Rebecca Sugar,"Zach Callison, Deedee Magno, Estelle"
15534,Ed Stone,"Amanda Peet, Dermot Mulroney, Sarah Paulson"
3172,Barry Levinson,"Bruce Willis, Billy Bob Thornton, Cate Blanchett"
874,Fred Zinnemann,"Paul Scofield, Wendy Hiller, Leo McKern"
22825,Richard Kelly,"Cameron Diaz, James Marsden, Frank Langella"
11033,Brian De Palma,"Michael Caine, Angie Dickinson, Nancy Allen"
8965,Victor Cook,"James Arnold Taylor, Cree Summer, John Mahoney"
463116,Oleg Malamuzh,"Nadiia Dorofieieva, Oleksii Zavgorodnii, Yevhen Malukha"
46838,Eli Craig,"Tyler Labine, Alan Tudyk, Katrina Bowden"
306819,Tom Hooper,"Eddie Redmayne, Alicia Vikander, Matthias Schoenaerts"
1150366,Gigi Saul Guerrero,"Annie Gonzalez, Cinthya Carmona, J.R. Villarreal"
740441,Kim Tae-joon,"Chun Woo-hee, Yim Si-wan, Kim Hee-won"
11943,Sydney Pollack,"Robert Redford, Will Geer, Delle Bolton"
11511,Paul Michael Glaser,"Shaquille O'Neal, Francis Capra, Ally Walker"
863929,Paolo Costella,"Claudio Bisio, Vittoria Puccini, Valentina Lodovini"
421471,Max Winkler,"Zoey Deutch, Kathryn Hahn, Tim Heidecker"
633374,Lee Il-hyung,"Lee Sung-min, Nam Joo-hyuk, Park Keun-hyong"
17185,Otto Preminger,"Henry Fonda, Charles Laughton, Don Murray"
15991,Frank Henenlotter,"Charlee Danielson, Anthony Sneed, Ginger Starr"
1034751,Iván Mulero,"Noel Gugliemi, Olga Aguilar, María Conchita Alonso"
293970,Todd Strauss-Schulson,"Taissa Farmiga, Malin Åkerman, Nina Dobrev"
22907,John Luessenhop,"Chris Brown, Hayden Christensen, Matt Dillon"
54318,Jay Russell,"Alex Etel, Emily Watson, Ben Chaplin"
11860,Sydney Pollack,"Harrison Ford, Julia Ormond, Greg Kinnear"
192102,McG,"Kevin Costner, Amber Heard, Hailee Steinfeld"
928344,Eric Appel,"Daniel Radcliffe, Evan Rachel Wood, Rainn Wilson"
11916,Don Siegel,"Shirley MacLaine, Clint Eastwood, Manolo Fábregas"
336592,Gail Willumsen,"Matthew McConaughey, Kip Thorne, Christopher Nolan"
88096,Stevie Wermers-Skelton,"Dave Foley, Sarah Chalke, Emily Alyn Lind"
16980,Whit Stillman,"Chloë Sevigny, Kate Beckinsale, Chris Eigeman"
16409,Joel Hopkins,"Dustin Hoffman, Emma Thompson, Eileen Atkins"
17082,Dante Lam Chiu-Yin,"Richie Jen, Edison Chen, Huang Xiaoming"
76589,Lauren Montgomery,"Kevin Conroy, Tim Daly, Susan Eisenberg"
119892,Soi Cheang,"Donnie Yen, Aaron Kwok Fu-Shing, Joe Chen"
958263,Baik,"Cho Jin-woong, Cha Seung-won, Han Hyo-joo"
631947,Patricia Harris Seeley,"Autumn Reeser, Antonio Cupo, Danny Trejo"
25218,Bill Guttentag,"Eva Mendes, David Krumholtz, Rob Brown"
1226843,Connor N. F. Field,"Grayson Buehler, Emilio Nagel, Lauren Dziuk"
34065,Kunihiko Yuyama,"Rica Matsumoto, Ikue Otani, KAORI"
1039773,Kobi Libii,"Justice Smith, David Alan Grier, An-Li Bogan"
189349,Hayato Date,"Junko Takeuchi, Ikue Otani, Kazuhiko Inoue"
10739,Woody Allen,"Jason Biggs, Christina Ricci, Woody Allen"
27118,Sidney Lanfield,"Richard Greene, Basil Rathbone, Wendy Barrie"
10794,Blake Edwards,"Peter Sellers, Claudine Longet, Natalia Borisova"
841742,Karim Ouelhaj,"Eline Schumacher, Benjamin Ramon, Wim Willaert"
301351,Max Joseph,"Zac Efron, Wes Bentley, Emily Ratajkowski"
401544,G.J. Echternkamp,"Manu Bennett, Malcolm McDowell, Marci Miller"
256687,Keith Parmer,"Jean-Claude Van Damme, Alfred Molina, Catalina Sandino Moreno"
222724,Daniel Farrands,"Emma Jacobs, Peter M. Bracke, Jennifer Banko"
1126577,Timothy Woodward Jr.,"Cam Gigandet, Jason Patric, Natalie Burn"
429197,Adam McKay,"Christian Bale, Amy Adams, Steve Carell"
340674,Alexandros Avranas,"Jim Carrey, Marton Csokas, Charlotte Gainsbourg"
11489,Jean-Pierre Dardenne,"Émilie Dequenne, Olivier Gourmet, Fabrizio Rongione"
1078249,Ole Christian Madsen,"Ulrich Thomsen, Sofie Torp, Afshin Firouzi"
513434,Shinichiro Ueda,"Takayuki Hamatsu, Yuzuki Akiyama, Kazuaki Nagaya"
253350,Aldo Lado,"Massimo Ranieri, Dayle Haddon, Christian De Sica"
9091,Peter Hyams,"Jean-Claude Van Damme, Powers Boothe, Raymond J. Barry"
462183,Joan Fermí Martí,"Fabián Castro, Julia Hernández, Richie Ormon"
33667,Elia Kazan,"Gregory Peck, Dorothy McGuire, John Garfield"
25403,Nanni Moretti,"Nanni Moretti, Renato Carpentieri, Antonio Neiwiller"
4170,Marco Kreuzpaintner,"Kevin Kline, Cesar Ramos, Paulina Gaitán"
9326,Robert Zemeckis,"Michael Douglas, Kathleen Turner, Danny DeVito"
244403,William H. Macy,"Billy Crudup, Anton Yelchin, Felicity Huffman"
297021,Iggy Coen,"Tenka Hashimoto, Yūkichi Kobayashi, Mayu Mitsui"
253312,Jack Plotnick,"Matt Bomer, Jerry O'Connell, Liv Tyler"
16164,John Madden,"Mickey Rourke, Diane Lane, Thomas Jane"
9699,Blake Edwards,"David Niven, Herbert Lom, Richard Mulligan"
1028318,Jianming Huang,"Liu Cong, Kai Wang, Zhang Zhe"
1274056,Vinicius Bellemo,"Alessandro Mizzi, Susanna Paravisi, Aurora Formenti"
16335,Gilles Paquet-Brenner,"Mischa Barton, Cameron Bright, Deborah Kara Unger"
15664,Chris Gorak,"Mary McCormack, Rory Cochrane, Tony Perez"
1126357,Edwin,"Putri Marino, Yoga Pratama, Lukman Sardi"
1006026,,"Do Mo-Se, Jin Joo, Jeon Ji-hak"
14560,Steve Carr,"Kevin James, Keir O'Donnell, Jayma Mays"
132318,Kunihiko Yuyama,"Toru Furuya, Eriko Hara, Hiromi Tsuru"
11176,James Frawley,"Jim Henson, Frank Oz, Jerry Nelson"
24919,Andrea Bianchi,"Karin Well, Gianluigi Chirizzi, Mariangela Giordano"
19918,David Mackenzie,"Ashton Kutcher, Anne Heche, Margarita Levieva"
425134,Ken Marino,"Eugenio Derbez, Salma Hayek Pinault, Raphael Alejandro"
1159086,Celso R. García,"Memo Villegas, Pierre Louis, Yalitza Aparicio"
407742,Joe D'Amato,"Ajita Wilson, Marina Hedman, Rick 'Ercolino' Martino"
1319504,Mackenzie Munro,"Rachel Boudwin, Drew Ray Tanner, Rachel Boyd"
339274,Imtiaz Ali,"Ranbir Kapoor, Deepika Padukone, Piyush Mishra"
13374,Tim Fywell,"Michelle Trachtenberg, Joan Cusack, Amy Stewart"
8321,Martin McDonagh,"Colin Farrell, Brendan Gleeson, Ralph Fiennes"
524348,Scott Z. Burns,"Adam Driver, Annette Bening, Jon Hamm"
228066,Paul McGuigan,"James McAvoy, Daniel Radcliffe, Jessica Brown Findlay"
13600,Gil Kenan,"Saoirse Ronan, Harry Treadaway, Bill Murray"
370567,John Stevenson,"Johnny Depp, Emily Blunt, James McAvoy"
31606,Andrew Davis,"Gene Hackman, Joanna Cassidy, Tommy Lee Jones"
1872,Sebastian Gutierrez,"Lucy Liu, Michael Chiklis, Carla Gugino"
600184,Roberto De Feo,"Francesca Cavallin, Ginevra Francesconi, Justin Alexander Korovkin"
1000475,Ben Ketai,"Adam Brody, Leighton Meester, Taran Killam"
43930,Stuart Beattie,"Caitlin Stasey, Rachel Hurd-Wood, Phoebe Tonkin"
14750,Mel Damski,"Doug McKeon, Catherine Mary Stewart, Kelly Preston"
997086,Keisuke Inoue,"Maaya Uchida, Shouta Aoi, Miho Okasaki"
2157,Stephen Hopkins,"William Hurt, Matt LeBlanc, Mimi Rogers"
1048516,Maria Sadowska,"Helena Englert, Piotr Stramowski, Andrea Preti"
10061,John Carpenter,"Kurt Russell, Stacy Keach, Steve Buscemi"
605375,Tony Chan,"Huang Xiaoming, Du Jiang, Tan Zhuo"
763788,David Hackl,"Scott Eastwood, Mel Gibson, Tyrese Gibson"
157424,Kaare Andrews,"Jillian Murray, Mitch Ryan, Lydia Hearst"
436565,Roberto Mauri,"Femi Benussi, Daniela Giordano, Alfonso Saggese"
30020,Abbas Kiarostami,"Homayoun Ershadi, Abdolrahman Bagheri, Safar Ali Moradi"
77016,David Ayer,"Jake Gyllenhaal, Michael Peña, Natalie Martinez"
1153194,,
512901,Yan Jia,"Jackie Chan, Elane Zhong, Ethan Juan"
41505,Björn Stein,"Julianne Moore, Jonathan Rhys Meyers, Jeffrey DeMunn"
22971,Lasse Hallström,"Amanda Seyfried, Channing Tatum, Richard Jenkins"
118957,Kimble Rendall,"Sharni Vinson, Phoebe Tonkin, Julian McMahon"
10775,Alan Mak,"Andy Lau Tak-Wah, Tony Leung Chiu-Wai, Anthony Wong Chau-Sang"
160768,Arnaud Desplechin,"Benicio del Toro, Mathieu Amalric, Gina McKee"
158999,Gabriela Cowperthwaite,"Dean Gomersall, Samantha Berg, John Jett"
11901,Clint Eastwood,"Clint Eastwood, Verna Bloom, Marianna Hill"
973912,Julien Hervé,"Christian Clavier, Didier Bourdon, Sylvie Testud"
698948,Ron Howard,"Viggo Mortensen, Colin Farrell, Joel Edgerton"
176339,Phillip Noyce,"Hilary Swank, Brenda Blethyn, Sam Claflin"
968,Sidney Lumet,"Al Pacino, John Cazale, Charles Durning"
140934,Michelle Mower,"Andrea Bowen, Lew Temple, Adam Mayfield"
8327,Alejandro Jodorowsky,"Alejandro Jodorowsky, Horacio Salinas, Zamira Saunders"
974558,Josh Forbes,"Jonah Ray Rodrigues, Kiran Deol, Randee Heller"
182560,Gilles Paquet-Brenner,"Charlize Theron, Nicholas Hoult, Chloë Grace Moretz"
1117465,Sahra Mani,
45682,Jiang Ping,"Zhang Yishan, Jackie Chan, Jiang Hongbo"
182,Steven Soderbergh,"George Clooney, Cate Blanchett, Tobey Maguire"
2614,Joe Dante,"Dennis Quaid, Martin Short, Meg Ryan"
974250,Potsy Ponciroli,"Himesh Patel, Joseph Gordon-Levitt, Lily James"
412013,Mikkel Munch-Fals,"Martin Buch, Mille Dinesen, Rasmus Botoft"
595216,Jacques Kluger,"Charley Palmer Rothwell, Roxane Mesquida, Laetitia Chambon"
1337404,Christopher Novabos,"Candy Veloso, Salome Salvi, Marlon Marcia"
505948,Grant Sputore,"Clara Rugaard, Rose Byrne, Hilary Swank"
17687,William A. Wellman,"James Cagney, Jean Harlow, Edward Woods"
843906,Cecilia Aranovich,"Matthew Lillard, Thea White, Grey DeLisle"
1075,Emir Kusturica,"Bajram Severdžan, Srđan 'Žika' Todorović, Zabit Memedov"
469877,Maxim Ford,"Danielle Rose, Taylor Sands, Paweł Hajnos"
10647,Mimi Leder,"Kevin Spacey, Helen Hunt, Angie Dickinson"
398175,S. Craig Zahler,"Vince Vaughn, Jennifer Carpenter, Don Johnson"
1033774,Aleksandr Voytinskiy,"Nikita Kologrivyy, Mila Ershova, Alina Alekseeva"
173304,Lav Diaz,"Sid Lucero, Ronnie Lazaro, Perry Dizon"
145,Lars von Trier,"Emily Watson, Stellan Skarsgård, Katrin Cartlidge"
16662,Sergio Sollima,"Lee Van Cleef, Tomas Milian, Walter Barnes"
1154268,Maclain Nelson,"Lacey Chabert, Wes Brown, Ellen Travolta"
502425,Francis Annan,"Daniel Radcliffe, Daniel Webber, Ian Hart"
339331,Gianfranco Angelucci,"Clio Goldsmith, Catherine Spaak, Fernando Rey"
36968,Mark Rosman,"Lindsay Lohan, Tyra Banks, Jere Burns"
1440,Todd Field,"Kate Winslet, Patrick Wilson, Jennifer Connelly"
11975,Francis Ford Coppola,"Matt Damon, Claire Danes, Danny DeVito"
468202,Donato Carrisi,"Toni Servillo, Jean Reno, Alessio Boni"
510460,Cédric Anger,"Guillaume Canet, Gilles Lellouche, Michel Fau"
10083,Roger Donaldson,"Kevin Costner, Gene Hackman, Sean Young"
40850,Lisa Barros D'Sa,"Rupert Grint, Robert Sheehan, James Nesbitt"
615666,Gil Kenan,"Henry Lawfull, Michiel Huisman, Stephen Merchant"
18167,Anne Goursaud,"Mickey Rourke, Agathe de La Fontaine, Angie Everhart"
24749,Fred Schepisi,"Timothy Hutton, Lindsay Crouse, John Lone"
161285,Jiang Wen,"Yu Xia, Ning Jing, Geng Le"
13335,Jon Hurwitz,"John Cho, Kal Penn, Neil Patrick Harris"
1155828,Greg Kwedar,"Colman Domingo, Clarence Maclin, Sean San Jose"
1133923,Juan Felipe Orozco,"Andrés Parra, Aria Jara, Juan Pablo Urrego"
828373,Jude Bauman,"Iris Jodorowsky, Amandine Noworyta, William Mesguich"
14092,Mamoru Oshii,"Atsuko Tanaka, Akio Otsuka, Koichi Yamadera"
9890,Frank Oz,"Nicole Kidman, Matthew Broderick, Bette Midler"
14979,Mimi Leder,"Morgan Freeman, Antonio Banderas, Radha Mitchell"
334538,Patricia Rozema,"Elliot Page, Evan Rachel Wood, Max Minghella"
10253,Hyung-rae Shim,"Jason Behr, Amanda Brooks, Robert Forster"
285213,Lee Suk-hoon,"Son Ye-jin, Kim Nam-gil, Oh Dal-su"
1480,Orson Welles,"Charlton Heston, Janet Leigh, Orson Welles"
22537,Toshiya Shinohara,"Kappei Yamaguchi, Satsuki Yukino, Koji Tsujitani"
2625,Mike Figgis,"Richard Gere, Lena Olin, Anne Bancroft"
1008374,Bess Wohl,"Noémie Merlant, Kit Harington, Camila Canó-Flaviá"
855400,T. J. Gnanavel,"Suriya, Lijomol Jose, Baby Joshika Maya"
468,Gus Van Sant,"River Phoenix, Keanu Reeves, William Richert"
1027385,Sean McNamara,"Jonathan Rhys Meyers, Will Sasso, Jon Voight"
9090,Beeban Kidron,"Patrick Swayze, Wesley Snipes, John Leguizamo"
640028,Ida Cuéllar,"Sperry Andrews, Sam Quiñones, Toni Karam"
1059345,Jon Keeyes,"Alice Eve, Antonio Banderas, Shelley Hennig"
111972,Yam Laranas,"Maui Taylor, Rica Peralejo, Ricky Davao"
858485,Rishab Shetty,"Rishab Shetty, Sapthami Gowda, Kishore"
31417,Georges Franju,"Pierre Brasseur, Alida Valli, Édith Scob"
489932,Anthony Mandler,"Kelvin Harrison Jr., Jeffrey Wright, Jennifer Hudson"
11884,Nick Castle,"Lance Guest, Robert Preston, Chris Hebert"
518497,Rohena Gera,"Tillotama Shome, Vivek Gomber, Geetanjali Kulkarni"
1018634,Saïd Belktibia,"Golshifteh Farahani, Amine Zariouhi, Denis Lavant"
70074,Walter Hill,"Sylvester Stallone, Sung Kang, Sarah Shahi"
18937,Frederik Du Chau,"Jessalyn Gilsig, Andrea Corr, Cary Elwes"
1279433,Sylwester Jakimow,"Maciej Stuhr, Gabriela Muskała, Franciszek Słomiński"
232391,Sananjit Bangsapan,"Patharawarin Timkul, Kanokwan Losiri, Sueangsuda Lawanprasert"
536869,Tom Hooper,"Francesca Hayward, Judi Dench, Idris Elba"
15944,Charles Barton,"Fred MacMurray, Jean Hagen, Tommy Kirk"
12113,Ridley Scott,"Leonardo DiCaprio, Russell Crowe, Mark Strong"
896221,Sean Charmatz,"Anna Kendrick, Justin Timberlake, Kenan Thompson"
277685,Levan Gabriadze,"Shelley Hennig, Heather Sossaman, Renee Olstead"
8286,Claude Chabrol,"Stéphane Audran, Michel Bouquet, Maurice Ronet"
928381,Régis Blondeau,"Franck Gastambide, Simon Abkarian, Michaël Abiteboul"
298115,John Sanford,"Jay Baruchel, America Ferrera, Christopher Mintz-Plasse"
97430,RZA,"RZA, Russell Crowe, Lucy Liu"
1175942,Pierre Perifel,"Sam Rockwell, Marc Maron, Craig Robinson"
75629,Hideaki Anno,"Megumi Ogata, Yuko Miyamura, Akira Ishida"
254065,Gregg Champion,"Regina King, Imani Hakim, Sydney Mikayla"
585244,Andrew Erwin,"K.J. Apa, Britt Robertson, Nathan Parsons"
308504,Kazuaki Kiriya,"Clive Owen, Morgan Freeman, Aksel Hennie"
418896,Jayme Monjardim,"César Troncoso, Dan Stulbach, Thiago Mendonça"
25504,Samuel Fuller,"Peter Breck, Constance Towers, Gene Evans"
1084222,Louis Mandylor,"Jonathan Rhys Meyers, Louis Mandylor, Peter Dobson"
39345,Sean McNamara,"Hilary Duff, Shelley Duvall, Cathy Moriarty"
1157023,Zacharias Mavroeidis,"Yorgos Tsiantoulas, Andreas Lampropoulos, Nikolas Mihas"
950253,Kim Seong-sik,"Gang Dong-won, Heo Joon-ho, Esom"
818721,Yann Gozlan,"Diane Kruger, Marta Nieto, Mathieu Kassovitz"
51881,Ronald F. Maxwell,"Hayley Mills, Tom Skerritt, Carrie Kei Heim"
188222,Doug Ellin,"Kevin Connolly, Adrian Grenier, Kevin Dillon"
4566,Tony Gilroy,"George Clooney, Tom Wilkinson, Tilda Swinton"
952079,Lee Sang-soo,"Yeon Joo, Yoo Ji-hyun, Im Tae-mok"
519010,Pedro Almodóvar,"Antonio Banderas, Asier Etxeandia, Leonardo Sbaraglia"
382517,David Feiss,"William Townsend, Donny Lucas, Melissa Sturm"
10257,Patrick Leung Pak-Kin,"Donnie Yen, Charlene Choi Cheuk-Yin, Gillian Chung"
4551,F. Gary Gray,"John Travolta, Uma Thurman, Vince Vaughn"
11822,Jörg Buttgereit,"Beatrice Manowski, Harald Lundt, Colloseo Schulzendorf"
513302,Hélène Giraud,"Bruno Salomone, Thierry Frémont, Stéphane Coulon"
137093,Jon Turteltaub,"Robert De Niro, Morgan Freeman, Michael Douglas"
415381,Ivan Shurkhovetskiy,"Ilya Malakov, Aleksandr Tsoy, Andrey Burkovskiy"
14433,Cy Endfield,"Stanley Baker, Jack Hawkins, Ulla Jacobsson"
13944,Rodrigo García,"Anne Hathaway, Patrick Wilson, Andre Braugher"
102207,Alain Chabat,"Alain Chabat, Jamel Debbouze, Fred Testot"
11657,Jean-Pierre Melville,"Alain Delon, Bourvil, Gian Maria Volonté"
606234,Gavin Rothery,"Theo James, Stacy Martin, Rhona Mitra"
1128604,Raymond S. Persi,"Arianna McDonald, Lexi Perri, Etienne Kellici"
45752,Ethan Spaulding,"Frank Welker, Mindy Cohn, Matthew Lillard"
11458,Daniel Algrant,"Al Pacino, Kim Basinger, Ryan O'Neal"
158928,Robert Allan Ackerman,"Helen Mirren, Olivier Martinez, Anne Bancroft"
11448,Woody Allen,"Woody Allen, Mira Sorvino, Helena Bonham Carter"
1154223,Jérémie Guez,"Sofiane Zermani, Waël Sersoub, Géraldine Nakache"
553835,Katsushi Sakurabi,"Yoshitsugu Matsuoka, Inori Minase, Maaya Sakamoto"
10328,Ron Howard,"Steve Guttenberg, Tahnee Welch, Brian Dennehy"
452970,Junji Shimizu,"Showtaro Morikubo, Ai Kayano, Sumire Uesaka"
25353,Pascal Hérold,"Jérôme Deschamps, Yolande Moreau, Louise Wallon"
17278,Jules Bass,"Boris Karloff, Allen Swift, Gale Garnett"
16083,Mark Fergus,"Guy Pearce, Piper Perabo, Steven Michael Quezada"
11515,Miloš Forman,"Javier Bardem, Natalie Portman, Stellan Skarsgård"
1229261,Crystal Moselle,"Derrick B. Harden, Irmena Chichikova, Stoyo Mirkov"
41245,Lee Chang-dong,"Sul Kyung-gu, Moon So-ri, Kim Yeo-jin"
1337886,Taylor Martin,"Simon Phillips, Nick Biskupek, Chad Ridgely"
18450,Duccio Tessari,"Alain Delon, Ottavia Piccolo, Moustache"
13353,Bill Melendez,"Peter Robbins, Christopher Shea, Sally Dryer"
13649,Kenny Ortega,"Zac Efron, Vanessa Hudgens, Ashley Tisdale"
10461,Stephen Kay,"Sylvester Stallone, Miranda Richardson, Rachael Leigh Cook"
10404,Zhang Yimou,"Gong Li, Ma Jingwu, He Saifei"
8967,Terrence Malick,"Brad Pitt, Sean Penn, Jessica Chastain"
897424,Jay Ness,"Brittany Benjamin, Amanda Day, Alexys Gabrielle"
5204,Nimród Antal,"Sándor Csányi, Csaba Pindroch, Zoltán Mucsi"
24883,Robert Dalva,"Kelly Reno, Vincent Spano, Allen Garfield"
11096,John Polson,"Robert De Niro, Dakota Fanning, Famke Janssen"
264525,Luis Estrada,"Damián Alcázar, Alfonso Herrera, Joaquín Cosío"
236399,Deborah Chow,"Heather Graham, Ellen Burstyn, Kiernan Shipka"
9489,Nora Ephron,"Meg Ryan, Tom Hanks, Greg Kinnear"
