movie_ID,director,top_actors
606117,Michelle Johnston,"Laura Marano, Gregg Sulkin, Isabella Gómez"
766680,Rodrigo Bellott,"Rob Finne, Elisha Burkhart, Uriyoan Carlos Ramos"
39105,Yoshihiro Ueda,"Masako Nozawa, Daisuke Gori, Tessyo Genda"
244316,David Hackl,"James Marsden, Thomas Jane, Piper Perabo"
1632,Alan Parker,"Gene Hackman, Willem Dafoe, Frances McDormand"
499191,Daisuke Miura,"Tori Matsuzaka, Sei Matobu, Ami Tomite"
17529,Henry Hathaway,"John Wayne, Kim Darby, Glen Campbell"
914206,Bertrand Bonello,"Léa Seydoux, George MacKay, Guslagie Malanda"
55301,Mike Mitchell,"Jason Lee, David Cross, Jenny Slate"
9470,Stephen Chow Sing-Chi,"Stephen Chow Sing-Chi, Yuen Qiu, Yuen Wah"
1205781,Don Kim,"Diana Zermeño, Asher Colton Spence, Marc Weiner"
59961,Daniel Espinosa,"Denzel Washington, Ryan Reynolds, Vera Farmiga"
1128559,Ian Bonhôte,"Christopher Reeve, Dana Reeve, Matthew Reeve"
11013,Steven Shainberg,"James Spader, Maggie Gyllenhaal, Jeremy Davies"
14199,Robert Rodriguez,"Taylor Lautner, Taylor Dooley, Cayden Boyd"
10865,Gary Trousdale,"Michael J. Fox, Cree Summer, James Garner"
9659,George Miller,"Mel Gibson, Joanne Samuel, Hugh Keays-Byrne"
9928,Chris Wedge,"Ewan McGregor, Robin Williams, Halle Berry"
1107128,Taylor Morden,"Damon Lindelof, Evangeline Lilly, Jorge Garcia"
289,Michael Curtiz,"Humphrey Bogart, Ingrid Bergman, Paul Henreid"
9543,Mike Newell,"Jake Gyllenhaal, Gemma Arterton, Ben Kingsley"
64682,Baz Luhrmann,"Leonardo DiCaprio, Tobey Maguire, Carey Mulligan"
410685,Hayato Date,"Junko Takeuchi, Kazuhiko Inoue, Chie Nakamura"
617653,Ridley Scott,"Jodie Comer, Matt Damon, Adam Driver"
36419,Agnieszka Wojtowicz-Vosloo,"Christina Ricci, Liam Neeson, Justin Long"
15657,Brian Smith,"Harrison Chad, George Carlin, Brad Garrett"
181283,Daniel Espinosa,"Tom Hardy, Gary Oldman, Noomi Rapace"
406563,Adam Robitel,"Lin Shaye, Leigh Whannell, Angus Sampson"
814776,Emma Seligman,"Rachel Sennott, Ayo Edebiri, Ruby Cruz"
318846,Adam McKay,"Steve Carell, Christian Bale, John Magaro"
243688,Gil Kenan,"Sam Rockwell, Rosemarie DeWitt, Saxon Sharbino"
45139,Peter Sykes,"Brian Deacon, Rivka Neuman, Alexander Scourby"
16866,Jorge Blanco,"Dwayne Johnson, Seann William Scott, Jessica Biel"
1371350,Nthabiseng Mokoena,"Renate Stuurman, Gail Mabalane, Richard Lukunku"
646380,Adam McKay,"Leonardo DiCaprio, Jennifer Lawrence, Meryl Streep"
181886,Denis Villeneuve,"Jake Gyllenhaal, Mélanie Laurent, Sarah Gadon"
9739,Marco Brambilla,"Sylvester Stallone, Wesley Snipes, Sandra Bullock"
817758,Todd Field,"Cate Blanchett, Nina Hoss, Noémie Merlant"
6957,Judd Apatow,"Steve Carell, Catherine Keener, Paul Rudd"
974453,Hans Petter Moland,"Liam Neeson, Ron Perlman, Yolonda Ross"
11412,Renny Harlin,"Geena Davis, Samuel L. Jackson, Yvonne Zima"
676701,Enrique Gato,"Óscar Barberán, Luis Posada, Michelle Jenner"
23483,Matthew Vaughn,"Aaron Taylor-Johnson, Chloë Grace Moretz, Nicolas Cage"
1026227,Paola Cortellesi,"Paola Cortellesi, Valerio Mastandrea, Romana Maggiora Vergano"
1844,Jon Amiel,"Catherine Zeta-Jones, Sean Connery, Will Patton"
274870,Morten Tyldum,"Jennifer Lawrence, Chris Pratt, Michael Sheen"
1727,John Badham,"Mel Gibson, Goldie Hawn, David Carradine"
1144323,,
398978,Martin Scorsese,"Robert De Niro, Al Pacino, Joe Pesci"
654739,Kim Chang-ju,"Jo Woo-jin, Lee Jae-in, Ji Chang-wook"
379686,Malcolm D. Lee,"LeBron James, Don Cheadle, Cedric Joe"
10137,Rob Minkoff,"Michael J. Fox, Chazz Palminteri, Nathan Lane"
634521,Yuichiro Hirakawa,"Minami Hamabe, Kairi Jo, Rihito Itagaki"
10431,Philip G. Atwell,"Jet Li, Jason Statham, John Lone"
355651,Rutger Veenstra,"Halina Reijn, Thijs Boermans"
117251,Roland Emmerich,"Channing Tatum, Jamie Foxx, Joey King"
9342,Martin Campbell,"Antonio Banderas, Anthony Hopkins, Catherine Zeta-Jones"
345330,Rolfe Kanefsky,"Allie Haze, Russia Hardy, Jason Sarcinelli"
24942,Werner Hedman,"Sigrid Horne-Rasmussen, Susanne Breuning, Kate Mundt"
175774,Felix Fuchssteiner,"Maria Ehrich, Jannis Niewöhner, Laura Berlin"
11381,Peter Segal,"Chris Farley, David Spade, Brian Dennehy"
832262,Robert Connolly,"Eric Bana, Anna Torv, Deborra-Lee Furness"
538751,Myeong Seok Hwan,"Joo Ye-bin, Baek Se-ri, Min Do-yoon"
788,Chris Columbus,"Robin Williams, Sally Field, Lisa Jakub"
1029578,Paula Elle,"Jen Lilley, Jesse Hutch, Nick Preston"
289225,Terry Cunningham,"Tom Everett Scott, Sarah Lancaster, Thomas Kapanowski"
446893,Walt Dohrn,"Anna Kendrick, Justin Timberlake, Ron Funches"
7980,Peter Jackson,"Saoirse Ronan, Mark Wahlberg, Rachel Weisz"
1164355,Baim Wong,"Taskya Namya, Yasamin Jasem, Arya Saloka"
1019828,Boon-lip Quah,"Jag Huang, Ivy Yin, Zhang Shi"
1231813,Choi Jong-gyoo,"Ga Won, White Sugar, Si Woo"
645710,Michael Mohan,"Sydney Sweeney, Justice Smith, Ben Hardy"
346648,Paul King,"Ben Whishaw, Sally Hawkins, Hugh Bonneville"
23827,Oren Peli,"Katie Featherston, Micah Sloat, Mark Fredrichs"
842859,Michel Hazanavicius,"Jean-Louis Trintignant, Dominique Blanc, Grégory Gadebois"
486589,Hong Sung-ho,"Chloë Grace Moretz, Sam Claflin, Gina Gershon"
11906,Dario Argento,"Jessica Harper, Stefania Casini, Flavio Bucci"
630004,Jaume Balagueró,"Freddie Highmore, Astrid Bergès-Frisbey, Jose Coronado"
11620,Mervyn LeRoy,"Robert Taylor, Deborah Kerr, Leo Genn"
60307,David Bowers,"Zachary Gordon, Devon Bostick, Robert Capron"
15915,Bertrand Bonello,"Jean-Pierre Léaud, Jérémie Renier, Dominique Blanc"
598331,Hamish Grieve,"Will Arnett, Geraldine Viswanathan, Stephen A. Smith"
1355755,David Lowery,"Cary Christopher, Estella Madrigal, Jim Gaffigan"
533444,Trey Edward Shults,"Kelvin Harrison Jr., Taylor Russell, Renée Elise Goldsberry"
107,Guy Ritchie,"Brad Pitt, Jason Statham, Alan Ford"
10494,Satoshi Kon,"Junko Iwao, Rica Matsumoto, Shiho Niiyama"
256731,Chris Brinker,"Matt Dillon, Willem Dafoe, Neal McDonough"
16258,Seth Grossman,"Mia Serafino, Rachel Miner, Chris Carmack"
1022690,Peter Farrelly,"Zac Efron, John Cena, Jermaine Fowler"
1372,Edward Zwick,"Leonardo DiCaprio, Djimon Hounsou, Jennifer Connelly"
480414,Michael Chaves,"Linda Cardellini, Raymond Cruz, Patricia Velásquez"
100402,Joe Russo,"Chris Evans, Samuel L. Jackson, Scarlett Johansson"
170522,Alexandre Astier,"Roger Carel, Alexandre Astier, Lionnel Astier"
29993,Cecil B. DeMille,"Hedy Lamarr, Victor Mature, George Sanders"
10764,Marc Forster,"Daniel Craig, Olga Kurylenko, Mathieu Amalric"
63193,Peter Werner,"James Wolk, Treat Williams, Dominic Scott Kay"
10019,Michael Gottlieb,"Andrew McCarthy, Kim Cattrall, Estelle Getty"
10771,Kevin Donovan,"Jackie Chan, Jennifer Love Hewitt, Jason Isaacs"
1146302,Thom Zimny,"Sylvester Stallone, Arnold Schwarzenegger, Frank Stallone Jr."
36586,Guillermo del Toro,"Wesley Snipes, Kris Kristofferson, Ron Perlman"
2517,Hirokazu Kore-eda,"Yuya Yagira, Ayu Kitaura, Hiei Kimura"
931405,Stanley Tsang,"Nianci Shen, Liang Dawei, Liang Zou"
186,Paul McGuigan,"Josh Hartnett, Morgan Freeman, Ben Kingsley"
24696,Spike Brandt,"Kathleen Barr, Garry Chalk, Ian James Corlett"
257091,Etan Cohen,"Will Ferrell, Kevin Hart, Alison Brie"
520023,Halina Reijn,"Amandla Stenberg, Maria Bakalova, Myha'la"
363676,Clint Eastwood,"Tom Hanks, Aaron Eckhart, Laura Linney"
37021,Iku Suzuki,"Kappei Yamaguchi, Megumi Hayashibara, Koichi Yamadera"
16995,Kevin Macdonald,"Russell Crowe, Ben Affleck, Rachel McAdams"
595,Robert Mulligan,"Mary Badham, Gregory Peck, Phillip Alford"
464889,Claudio Fäh,"Chad Michael Collins, Danay García, Joe Lando"
830896,Jeffrey Walker,"Christoph Waltz, Patrick Gibson, Damon Herriman"
16643,Stephen Herek,"Angelina Jolie, Edward Burns, Tony Shalhoub"
11576,Stanley Kramer,"Spencer Tracy, Milton Berle, Sid Caesar"
1337402,Jaque Carlos,"Aiko Garcia, Jenn Rosa, Josef Elizalde"
364689,Carlos Saldanha,"John Cena, Kate McKinnon, Anthony Anderson"
1148817,Anggy Umbara,"Nayla D. Purnama, Lydia Kandou, Gisellma Firmansyah"
157544,Mark Neveldine,"Olivia Taylor Dudley, Michael Peña, Peter Andersson"
956,J.J. Abrams,"Tom Cruise, Philip Seymour Hoffman, Ving Rhames"
166747,Dustin McKenzie,"Kate Higgins, Debi Derryberry, Salli Saffioti"
15601,Jim Stenstrum,"Scott Innes, Frank Welker, Grey DeLisle"
591538,Joel Coen,"Denzel Washington, Frances McDormand, Alex Hassell"
676,Michael Bay,"Ben Affleck, Kate Beckinsale, Josh Hartnett"
16938,Bob Clark,"Olivia Hussey, Keir Dullea, Margot Kidder"
270774,Renny Harlin,"Jackie Chan, Johnny Knoxville, Fan Bingbing"
64688,Phil Lord,"Jonah Hill, Channing Tatum, Brie Larson"
290250,Shane Black,"Russell Crowe, Ryan Gosling, Angourie Rice"
1184371,,Hitomi Tanaka
11976,Ridley Scott,"Tom Cruise, Mia Sara, Tim Curry"
1216299,Paul G. Volk,"Brian Austin Green, Tim Abell, Charlie N. Townsend"
16672,Hiroshi Teshigahara,"Eiji Okada, Kyôko Kishida, Hiroko Itō"
862557,Jeff Celentano,"Colin Ford, Dennis Quaid, Joelle Carter"
1134562,Ezekiel Decker,"Jessica Dawn Willis, Matthew Tompkins, Phil Harrison"
1080512,Quarxx,"Arben Bajraktaraj, Ophélia Kolb, Manon Maindivide"
3134,Virginie Despentes,"Karen Lancaume, Raffaëla Anderson, Ouassini Embarek"
24742,David Greenwalt,"C. Thomas Howell, Lori Loughlin, Kelly Preston"
16638,Anthony Mann,"Charlton Heston, Sophia Loren, Raf Vallone"
262391,Philippe de Chauveron,"Christian Clavier, Chantal Lauby, Ary Abittan"
1308623,Rhajov Villafuerte,Sergio Lebrija
100042,Bobby Farrelly,"Jim Carrey, Jeff Daniels, Laurie Holden"
25642,Alex Winter,"Ryan Kelley, Galadriel Stineman, Nathan Keyes"
319,Tony Scott,"Christian Slater, Patricia Arquette, Dennis Hopper"
597890,Neil Burger,"Tye Sheridan, Lily-Rose Depp, Fionn Whitehead"
10402,Mike Mitchell,"Rob Schneider, William Forsythe, Eddie Griffin"
961323,Troy Quane,"Chloë Grace Moretz, Riz Ahmed, Eugene Lee Yang"
238713,Paul Feig,"Melissa McCarthy, Rose Byrne, Jason Statham"
1159204,Crawford Watson,"Ariel Ash, Caroline Beagles, Will Branner"
310307,John Lee Hancock,"Michael Keaton, Nick Offerman, John Carroll Lynch"
185526,Kazuki Akane,"Miyu Irino, Maaya Sakamoto, Takehito Koyasu"
864101,Dmitry Kiselev,"Anatoliy Belyy, Darya Moroz, Veronika Ustimova"
462650,Roy Burdine,"Eric Bauza, Jayma Mays, Maria Bamford"
8913,Mary Lambert,"Dale Midkiff, Fred Gwynne, Denise Crosby"
334,Paul Thomas Anderson,"Tom Cruise, Philip Baker Hall, Philip Seymour Hoffman"
369299,Gustavo Loza,"Karla Souza, Ricardo Abarca, Biassini Segura"
1825,Menahem Golan,"Sylvester Stallone, Robert Loggia, Susan Blakely"
16456,Lance Mungia,"Edward Furlong, Tara Reid, David Boreanaz"
77950,David Soren,"Ryan Reynolds, Paul Giamatti, Michael Peña"
601666,J Blakeson,"Rosamund Pike, Peter Dinklage, Eiza González"
47933,Roland Emmerich,"Liam Hemsworth, Jeff Goldblum, Jessie T. Usher"
8810,George Miller,"Mel Gibson, Bruce Spence, Michael Preston"
1857,Nelson Shin,"Judd Nelson, Peter Cullen, Frank Welker"
41733,Todd Phillips,"Robert Downey Jr., Zach Galifianakis, Michelle Monaghan"
764,Sam Raimi,"Bruce Campbell, Ellen Sandweiss, Richard DeManincor"
16538,John Hamburg,"Paul Rudd, Jason Segel, Rashida Jones"
1014214,Rohit Shetty,"Ajay Devgn, Kareena Kapoor Khan, Arjun Kapoor"
10948,Richard Rich,"Mickey Rooney, Kurt Russell, Pearl Bailey"
1093231,Mark Waters,"Brooke Shields, Miranda Cosgrove, Benjamin Bratt"
33409,Cyrus Nowrasteh,"Shohreh Aghdashloo, Mozhan Navabi, Jim Caviezel"
10528,Guy Ritchie,"Robert Downey Jr., Jude Law, Rachel McAdams"
261023,Scott Cooper,"Johnny Depp, Joel Edgerton, Julianne Nicholson"
7446,Ben Stiller,"Ben Stiller, Robert Downey Jr., Jack Black"
65754,David Fincher,"Daniel Craig, Rooney Mara, Christopher Plummer"
9374,Robert Zemeckis,"Goldie Hawn, Bruce Willis, Meryl Streep"
1167027,Benjamin Ree,"Mats Steen, Robert Steen, Trude Steen"
11507,Brian De Palma,"Craig Wasson, Melanie Griffith, Gregg Henry"
275,Joel Coen,"Frances McDormand, William H. Macy, Steve Buscemi"
239678,Shawn Levy,"Jason Bateman, Tina Fey, Jane Fonda"
1927,Ang Lee,"Eric Bana, Jennifer Connelly, Sam Elliott"
964592,Jason Yu,"Jung Yu-mi, Lee Sun-kyun, Kim Kuk-hee"
16555,Tyler Perry,"Gabrielle Union, Idris Elba, Louis Gossett Jr."
27581,Adam McKay,"Will Ferrell, Mark Wahlberg, Eva Mendes"
1175038,Adam Newacheck,"Holly Kenney, Brendin Brown, Paris Nicole"
518068,Kim Yong-hwa,"Ha Jung-woo, Ju Ji-hoon, Kim Hyang-gi"
555604,Mark Gustafson,"Ewan McGregor, David Bradley, Gregory Mann"
830788,Jessica M. Thompson,"Nathalie Emmanuel, Thomas Doherty, Sean Pertwee"
927,Joe Dante,"Zach Galligan, Phoebe Cates, Hoyt Axton"
487297,Adam Shankman,"Taraji P. Henson, Aldis Hodge, Josh Brener"
924482,Howard J. Ford,"Brittany Ashworth, Nathan Welsh, Anaïs Parello"
515195,Danny Boyle,"Himesh Patel, Lily James, Sophia Di Martino"
966,John Sturges,"Yul Brynner, Eli Wallach, Steve McQueen"
920081,Mario N. Bonassin,"Eric Roberts, Michelle Elizabeth O'Shea, Emilia Torello"
505262,Kenji Nagasaki,"Daiki Yamashita, Kenta Miyake, Mirai Shida"
11587,William Peter Blatty,"George C. Scott, Ed Flanders, Brad Dourif"
13700,Will Finn,"Roseanne Barr, Judi Dench, Jennifer Tilly"
332567,Jaume Collet-Serra,"Blake Lively, Óscar Jaenada, Brett Cullen"
1643,Bernardo Bertolucci,"Marlon Brando, Maria Schneider, Maria Michi"
560057,Chris Williams,"Karl Urban, Zaris-Angel Hator, Jared Harris"
1104331,Yun Su-ik,"Han Hae-in, Han So-hee, Kim Geu-lim"
727745,Vince Marcello,"Joey King, Joel Courtney, Jacob Elordi"
17038,David Flores,"John Schneider, Sam McMurray, Sarah Lafleur"
120475,Yoshihiro Ueda,"Masako Nozawa, Ryusei Nakao, Houko Kuwashima"
36073,Hideshi Hino,"Hiroshi Tamura, Kirara Yugao"
11212,Patrick Read Johnson,"Joe Mantegna, Lara Flynn Boyle, Joe Pantoliano"
736526,Roar Uthaug,"Ine Marie Wilmann, Kim S. Falck-Jørgensen, Mads Sjøgård Pettersen"
1215918,Jeff Celentano,"Minka Kelly, Dermot Mulroney, Maggie Grace"
86834,Darren Aronofsky,"Russell Crowe, Jennifer Connelly, Ray Winstone"
409276,Kim Hyo-jae,"Kim Do-hee, Jung Won-II, James"
15357,Patrick Alessandrin,"Cyril Raffaelli, David Belle, Philippe Torreton"
1107387,Xu Ang,"Feng Xiaogang, Joan Chen, Bai Jugang"
938,Sergio Leone,"Clint Eastwood, Lee Van Cleef, Gian Maria Volonté"
4133,Ted Demme,"Johnny Depp, Penélope Cruz, Franka Potente"
1141132,Rizal Mantovani,"Risa Saraswati, Prinsa Mandagie, Dimas Tri Aditiyo"
2539,James L. Brooks,"Adam Sandler, Téa Leoni, Paz Vega"
458897,Elizabeth Banks,"Kristen Stewart, Naomi Scott, Ella Balinska"
52451,Paul W. S. Anderson,"Logan Lerman, Milla Jovovich, Matthew Macfadyen"
9655,Andy Fickman,"Amanda Bynes, Channing Tatum, Laura Ramsey"
25913,Phil Weinstein,"Maurice LaMarche, Jodi Benson, Lacey Chabert"
15804,Edward Yang,"Chang Chen, Lisa Yang, Chang Kuo-Chu"
522016,Simon Kinberg,"Jessica Chastain, Lupita Nyong'o, Penélope Cruz"
114286,Henning Carlsen,"Emilio Echevarría, Geraldine Chaplin, Ángela Molina"
123553,Harald Zwart,"Lily Collins, Jamie Campbell Bower, Robert Sheehan"
15392,Walter Hill,"Ralph Macchio, Joe Seneca, Jami Gertz"
134374,Michael Bay,"Mark Wahlberg, Dwayne Johnson, Anthony Mackie"
419479,McG,"Judah Lewis, Samara Weaving, Robbie Amell"
845387,Mari Okada,"Junya Enoki, Reina Ueda, Misaki Kuno"
259694,Christian Ditter,"Dakota Johnson, Rebel Wilson, Leslie Mann"
186383,Tomomi Mochizuki,"Toru Furuya, Eriko Hara, Maria Kawamura"
1995,Simon West,"Angelina Jolie, Iain Glen, Daniel Craig"
51481,Melanie Mayron,"Meaghan Jette Martin, Jennifer Stone, Maiara Walsh"
251387,Christian Sesma,"Jason Mewes, Danny Trejo, Chasty Ballesteros"
9444,Don Bluth,"Meg Ryan, John Cusack, Kelsey Grammer"
754609,Anthony Fabian,"Lesley Manville, Isabelle Huppert, Lambert Wilson"
3049,Tom Shadyac,"Jim Carrey, Courteney Cox, Sean Young"
1149920,Kristoffer Rus,"Maciej Karaś, Patryk Siemek, Amelia Fijałkowska"
11482,Roman Polanski,"Roman Polanski, Isabelle Adjani, Melvyn Douglas"
13248,Charles Visser,"Joe Alaskey, Bob Bergen, Billy West"
1146556,Kevin Smith,"Siena Agudong, Austin Zajur, Nicholas Cirillo"
11187,Jack Bender,"Justin Whalin, Brad Dourif, Perrey Reeves"
297090,Kōta Yoshida,"Noriko Kijima, Haruna Yoshizumi, Yuki Mamiya"
15268,Andrzej Bartkowiak,"Kristin Kreuk, Chris Klein, Neal McDonough"
9426,David Cronenberg,"Jeff Goldblum, Geena Davis, John Getz"
300669,Fede Álvarez,"Stephen Lang, Jane Levy, Dylan Minnette"
967,Stanley Kubrick,"Kirk Douglas, Laurence Olivier, Jean Simmons"
417870,Malcolm D. Lee,"Regina Hall, Queen Latifah, Jada Pinkett Smith"
1160003,Franck Khalfoun,"Camille Rowe, Aleksandar Popovic, J. John Bieler"
36648,David S. Goyer,"Wesley Snipes, Jessica Biel, Ryan Reynolds"
663,Darren Lynn Bousman,"Tobin Bell, Costas Mandylor, Scott Patterson"
4982,Ridley Scott,"Russell Crowe, Denzel Washington, Chiwetel Ejiofor"
1111491,Tyrrell Shaffner,"Dina Meyer, Aaron Dominguez, Julia Tolchin"
167073,John Crowley,"Saoirse Ronan, Domhnall Gleeson, Emory Cohen"
18462,Thom Eberhardt,"Catherine Mary Stewart, Robert Beltran, Kelli Maroney"
40108,Ilias Mylonakos,"Laura Gemser, Gabriele Tinti, Livia Russo"
523931,James Thomas,"Michael Madsen, Scott C. Roe, Ego Mikitas"
9874,George P. Cosmatos,"Sylvester Stallone, Brigitte Nielsen, Reni Santoni"
1216512,Miguel Puga,"Izabella Alvarez, Sumalee Montano, Paulina Chávez"
1135229,David Ryan Keith,"Hannaj Bang Bendz, Marta Svetek, Derek Nelson"
76493,Larry Charles,"Sacha Baron Cohen, Ben Kingsley, Anna Faris"
42246,Bill Kopp,"Charlie Adler, Jeff Bennett, John DiMaggio"
17336,Dito Montiel,"Channing Tatum, Terrence Howard, Zulay Henao"
893712,Ayako Kono,"Haruka Tomatsu, Yoshitsugu Matsuoka, Inori Minase"
1019836,Joe Begos,"Riley Dandy, Sam Delich, Jonah Ray Rodrigues"
188927,Justin Lin,"Chris Pine, Zachary Quinto, Karl Urban"
852432,Guillaume Nicloux,"Angèle Mac, Hatik, Ahmed Abdel Laoui"
1205025,Gavino Rocha,"Armina Alegre, Nico Locco, Mark Dionisio"
454640,Thurop Van Orman,"Jason Sudeikis, Josh Gad, Danny McBride"
11520,Donald Petrie,"Jack Lemmon, Walter Matthau, Ann-Margret"
25676,Benny Chan Muk-Sing,"Jackie Chan, Louis Koo, Michael Hui Koon-Man"
167,Iain Softley,"Jeff Bridges, Kevin Spacey, Mary McCormack"
37958,Tarsem Singh,"Henry Cavill, Mickey Rourke, Stephen Dorff"
951029,Lana Wilson,"Per Erik Borja, Eugene Grygo, Nikenya Hall"
1149947,Christopher Cassel,"J. Robert Oppenheimer, Ellen Bradbury Reid, Christopher Nolan"
1022685,Ernie Barbarash,"Jessica Lowndes, Paul Greene, Gladys Knight"
734002,Hugh Welchman,"Kamila Urzędowska, Robert Gulaczyk, Mirosław Baka"
50839,J.C. Chandor,"Kevin Spacey, Zachary Quinto, Paul Bettany"
84892,Stephen Chbosky,"Logan Lerman, Emma Watson, Ezra Miller"
914215,Caitlin Cronenberg,"Jay Baruchel, Emily Hampshire, Sebastian Chacon"
1134866,Stephen Hall,"John Rhys-Davies, Michael Yare, Elena Delia"
244267,Mike Cahill,"Michael Pitt, Brit Marling, Astrid Bergès-Frisbey"
26022,Karan Johar,"Shah Rukh Khan, Kajol, Arjan Aujla"
158445,Lee Hwan-kyung,"Ryu Seung-ryong, Park Shin-hye, Kal So-won"
672322,Keishi Otomo,"Takeru Satoh, Kasumi Arimura, Issey Takahashi"
63,Terry Gilliam,"Bruce Willis, Madeleine Stowe, Brad Pitt"
334074,James McTeigue,"Milla Jovovich, Pierce Brosnan, Dylan McDermott"
11419,Stephen Kessler,"Chevy Chase, Beverly D'Angelo, Randy Quaid"
16411,Andrew Lau Wai-Keung,"Jay Chou, Anne Suzuki, Jordan Chan Siu-Chun"
51736,Fernanda Cardoso,"Allison McAtee, Sarah Stouffer, Katherine Ann McGregor"
657,Terence Young,"Sean Connery, Daniela Bianchi, Pedro Armendáriz"
117,Brian De Palma,"Kevin Costner, Sean Connery, Charles Martin Smith"
1534,Marcus Nispel,"Karl Urban, Moon Bloodgood, Nicole Muñoz"
27576,Phillip Noyce,"Angelina Jolie, Liev Schreiber, Chiwetel Ejiofor"
4347,Joe Wright,"James McAvoy, Keira Knightley, Saoirse Ronan"
23437,Samuel Bayer,"Jackie Earle Haley, Kyle Gallner, Rooney Mara"
1022964,Reginald Hudlin,"Eddie Murphy, Tracee Ellis Ross, Jillian Bell"
940139,Robert Zemeckis,"Tom Hanks, Robin Wright, Paul Bettany"
1184773,Mathieu Bonzon,"Julie Gayet, Adelaide Kane, Jay O. Sanders"
559969,Vince Gilligan,"Aaron Paul, Jesse Plemons, Charles Baker"
10995,Jean-Jacques Annaud,"Jane March, Tony Leung Ka-Fai, Frédérique Meininger"
960042,Robert Guédiguian,"Ariane Ascaride, Jean-Pierre Darroussin, Lola Naymark"
293670,Na Hong-jin,"Kwak Do-won, Hwang Jung-min, Chun Woo-hee"
982940,Javier Reyna,"Kellan Lutz, Jeff Fahey, Efren Ramirez"
399402,Donovan Marsh,"Gerard Butler, Gary Oldman, Toby Stephens"
330980,Michael Lathrop,"David Joseph Magee, Erika McGann, Killian Coyle"
508664,Kriv Stenders,"Travis Fimmel, Luke Bracey, Daniel Webber"
17005,Harvey Glazer,"Jason Mewes, Erica Cox, Richard Fitzpatrick"
869,Tim Burton,"Mark Wahlberg, Tim Roth, Helena Bonham Carter"
206647,Sam Mendes,"Daniel Craig, Christoph Waltz, Léa Seydoux"
10510,Les Mayfield,"Mara Wilson, Richard Attenborough, Dylan McDermott"
783675,Takehiko Inoue,"Shugo Nakamura, Jun Kasama, Kenta Miyake"
185605,Shōgorō Nishimura,"Jun Izumi, Usagi Asō, Kate Asabuki"
834,Len Wiseman,"Kate Beckinsale, Scott Speedman, Tony Curran"
1427,Tom Tykwer,"Ben Whishaw, Alan Rickman, Rachel Hurd-Wood"
5548,Paul Verhoeven,"Peter Weller, Nancy Allen, Dan O'Herlihy"
1138476,Junta Yamaguchi,"Riko Fujitani, Yuki Torigoe, Munenori Nagano"
1357633,Shunsuke Nakashige,"Taito Ban, Genta Nakamura, Haruna Mikawa"
1248795,Recai Karagöz,"Birkan Sokullu, Esra Bilgiç, Fırat Tanış"
997162,Keir O'Donnell,"Joe Keery, Camila Morrone, Aldis Hodge"
1057491,Dmitriy Suvorov,"Anastasiya Reznik, Alexander Petrov, Semen Arzumanov"
10358,Kevin Smith,"Elizabeth Banks, Seth Rogen, Craig Robinson"
114606,Matthias Hoene,"Rasmus Hardiker, Harry Treadaway, Michelle Ryan"
8689,Ruggero Deodato,"Robert Kerman, Francesca Ciardi, Perry Pirkanen"
547016,Gina Prince-Bythewood,"Charlize Theron, KiKi Layne, Veronica Ngo"
1136837,Jia Zhang-ke,"Zhao Tao, Zhubin Li, Pan Jianlin"
955,John Woo,"Tom Cruise, Dougray Scott, Thandiwe Newton"
254473,Camille Delamarre,"Paul Walker, David Belle, RZA"
595801,Caleb J. Phillips,"Tyler Pochop, Teagan Rose, Josh Schell"
856,Robert Zemeckis,"Bob Hoskins, Christopher Lloyd, Joanna Cassidy"
338766,David Mackenzie,"Jeff Bridges, Chris Pine, Ben Foster"
204082,Gary Fleder,"Jason Statham, James Franco, Izabela Vidovic"
1079244,Todd Komarnicki,"Jonas Dassler, Phileas Heyblom, August Diehl"
848890,Chris McKay,"Chris Pratt, Yvonne Strahovski, J.K. Simmons"
1648,Stephen Herek,"Keanu Reeves, Alex Winter, George Carlin"
511817,Henry Selick,"Lyric Ross, Keegan-Michael Key, Jordan Peele"
11509,Lawrence Kasdan,"Kevin Kline, Scott Glenn, Danny Glover"
16804,Yojiro Takita,"Masahiro Motoki, Ryoko Hirosue, Tsutomu Yamazaki"
484641,Luc Besson,"Sasha Luss, Helen Mirren, Luke Evans"
116322,Alberto Rodríguez,"Rafael Inclán, Yair Prado, Mónica del Carmen"
270938,Ernie Barbarash,"Michael Jai White, Neal McDonough, Lateef Crowder"
2019,John Woo,"Jean-Claude Van Damme, Arnold Vosloo, Lance Henriksen"
184314,François Ozon,"Marine Vacth, Géraldine Pailhas, Charlotte Rampling"
9286,James Wong,"Mary Elizabeth Winstead, Ryan Merriman, Kris Lemche"
4523,Kevin Lima,"Amy Adams, Patrick Dempsey, James Marsden"
583833,Alexandr Domogarov Jr.,"Victor Dobronravov, Leonid Basov, Vladimir Ilin"
73475,Jesús Franco,"Vicky Adams, Ada Tauler, Karine Gambier"
16642,Terrence Malick,"Richard Gere, Brooke Adams, Sam Shepard"
549053,Paul Feig,"Emilia Clarke, Henry Golding, Michelle Yeoh"
169881,Philipp Stölzl,"Tom Payne, Ben Kingsley, Stellan Skarsgård"
172329,Hiroyuki Morita,"Mayumi Tanaka, Kazuya Nakai, Akemi Okamura"
11545,Wes Anderson,"Jason Schwartzman, Bill Murray, Olivia Williams"
960481,S. Baasanjargal,"Tserendolgor Munkhbat, Altantur Altanjargal, Setgeltuvshin Bayarbat"
12620,Fred Wolf,"Anna Faris, Colin Hanks, Emma Stone"
675531,David Slade,"Casey Likes, Emyri Crutchfield, Jeremy Davies"
1361240,Jason Bourque,"Taylor Cole, Kevin McGarry, Sarah-Jane Redmond"
476299,Pascal Laugier,"Crystal Reed, Mylène Farmer, Anastasia Phillips"
505026,Kenneth Branagh,"Kenneth Branagh, Tom Bateman, Annette Bening"
11589,Brian G. Hutton,"Clint Eastwood, Telly Savalas, Don Rickles"
3558,James Mangold,"Winona Ryder, Angelina Jolie, Clea DuVall"
7340,Brian De Palma,"Sissy Spacek, Piper Laurie, Amy Irving"
599,Billy Wilder,"William Holden, Gloria Swanson, Erich von Stroheim"
1297919,Hadrah Daeng Ratu,"Bryan Domani, Nadya Arina, Dhini Aminarti"
533514,Taichi Ishidate,"Yui Ishikawa, Daisuke Namikawa, Takehito Koyasu"
1026819,Louis Lagayette,"Lily Banda, Alec Newman, Mylène Jampanoï"
82695,Tom Hooper,"Hugh Jackman, Russell Crowe, Anne Hathaway"
1243895,Félix Sabroso,"Michelle Rodríguez, Consuelo Duval, Patricia Maqueo"
214,Darren Lynn Bousman,"Tobin Bell, Shawnee Smith, Angus Macfadyen"
396263,Yasushi Kawamura,"Yuki Kaji, Daisuke Ono, Saori Hayami"
70160,Gary Ross,"Jennifer Lawrence, Josh Hutcherson, Liam Hemsworth"
51540,Seth Gordon,"Jason Bateman, Charlie Day, Jason Sudeikis"
348350,Ron Howard,"Alden Ehrenreich, Joonas Suotamo, Woody Harrelson"
113899,Nando Cicero,"Lando Buzzanca, Rossana Podestà, Tiberio Murgia"
974961,Richard Gray,"Gabriel Byrne, Thomas Jane, Isaiah Mustafa"
809787,Catherine Hardwicke,"Toni Collette, Monica Bellucci, Sophia Nomvete"
11563,Jackie Chan,"Jackie Chan, Yuen Biao, Wai Pak"
8204,Mark Waters,"Freddie Highmore, Sarah Bolger, David Strathairn"
2034,Antoine Fuqua,"Denzel Washington, Ethan Hawke, Scott Glenn"
1247458,Maite Alberdi,"Elisa Zulueta, Francisca Lewin, Gabriel Urzúa"
4141,Michael Davis,"Clive Owen, Monica Bellucci, Paul Giamatti"
7182,Jim Gillespie,"Agnes Bruckner, Jonathan Jackson, Laura Ramsey"
669444,,"Francis Ginibre, Éric Carrière"
250388,Uwe Boll,"Brendan Fletcher, Lochlyn Munro, Mike Dopud"
588,Christophe Gans,"Radha Mitchell, Sean Bean, Jodelle Ferland"
465595,Park Sun-Uk,"Lee Chae-dam, Sin Seong-hoon, Yoon Se-na"
50698,Stuart Ortiz,"Sean Rogerson, Ashleigh Gryzko, Merwin Mondesir"
197796,Christophe Gans,"Léa Seydoux, Vincent Cassel, André Dussollier"
461130,Jeff Chan,"Robbie Amell, Stephen Amell, Kari Matchett"
747188,Wes Anderson,"Jason Schwartzman, Scarlett Johansson, Tom Hanks"
17689,Clint Eastwood,"Clint Eastwood, Sondra Locke, Pat Hingle"
24831,Joe Dante,"Bradford Dillman, Heather Menzies, Kevin McCarthy"
796185,Martin Bourboulon,"François Civil, Vincent Cassel, Romain Duris"
