movie_ID,director,top_actors
77887,Gary Rydstrom,"Tom Hanks, Tim Allen, Joan Cusack"
549787,Takuya Kawasaki,"Masataka Kubota, Shota Matsuda, Maika Yamamoto"
46581,Walerian Borowczyk,"Lise Danvers, Fabrice Luchini, Charlotte Alexandra"
1019939,Mike Cheslik,"Ryland Brickson Cole Tews, Olivia Graves, Doug Mancheski"
741074,Dan Abraham,"Josh Gad, Chris Williams, Idina Menzel"
25284,John Dahl,"Linda Fiorentino, Peter Berg, J.T. Walsh"
492008,Choi Jae-hoon,"Jang Hyuk, Kim Hyun-soo, Joe Taslim"
73134,David Hamilton,"Anja Schüte, Valérie Dumas, Thierry Tevini"
928833,Matt Burnett,"Philip Solomon, Noël Wells, Michael Croner"
399057,Yorgos Lanthimos,"Colin Farrell, Nicole Kidman, Barry Keoghan"
775568,Chang Jen-Chieh,"Man Wah Tsui, Charlie Cho Cha-Lee, Vincent Lam Wai"
11378,Jacques Tati,"Jacques Tati, Tony Knepper, Maria Kimberly"
17015,Roger Michell,"Amanda Root, Ciarán Hinds, Susan Fleetwood"
1064178,Elizabeth Blake-Thomas,"Mena Suvari, Casper Van Dien, Maya Stojan"
10497,Roman Polanski,"Peter Coyote, Emmanuelle Seigner, Hugh Grant"
853033,Kim Jong-min,"Ahn So-hee, Lee Chae-dam, Kim Soo-ji"
407439,Garth Davis,"Rooney Mara, Joaquin Phoenix, Chiwetel Ejiofor"
8095,Joseph L. Mankiewicz,"Elizabeth Taylor, Richard Burton, Rex Harrison"
2395,Thomas Langmann,"Gérard Depardieu, Clovis Cornillac, José Garcia"
24935,Ellory Elkayem,"Aimee-Lynn Chadwick, Cory Hardrict, John Keefe"
10131,Renny Harlin,"Robert Englund, Rodney Eastman, Danny Hassel"
1310978,David Jovanović,"Rastko Racić, Dušan Jović, Nataša Marković"
7484,Roger Allers,"Martin Lawrence, Ashton Kutcher, Gary Sinise"
893345,Matt Drummond,"Sam Everingham, Alyla Browne, Alice Parkinson"
259049,Mario Caiano,"Richard Harrison, Moira Orfei, Giuliano Gemma"
1702,Stephen Norrington,"Ely Pouget, Brad Dourif, William Hootkins"
556678,Autumn de Wilde,"Anya Taylor-Joy, Johnny Flynn, Josh O'Connor"
520901,Tony Giglio,"Amy Manson, Luke Allen-Gale, Nina Bergman"
1093485,Herman Yau,"Aaron Kwok Fu-Shing, Louis Koo, Sean Lau Ching-Wan"
485811,Chee Keong Cheung,"Oris Erhuero, Carlos Gallardo, Mark Strange"
1716,François Truffaut,"Catherine Deneuve, Gérard Depardieu, Jean Poiret"
9772,Wolfgang Petersen,"Harrison Ford, Gary Oldman, Glenn Close"
9645,Steve Beck,"Gabriel Byrne, Julianna Margulies, Desmond Harrington"
408620,Kim Sung-soo,"Jung Woo-sung, Hwang Jung-min, Ju Ji-hoon"
16127,Richard Elfman,"Hervé Villechaize, Susan Tyrrell, Matthew Bright"
886396,Matt Peters,"Jack Dylan Grazer, Jack Griffo, Laura Bailey"
1264966,Michael Vaynberg,"Monte Bezell, Michael Doyle, Lorianna Izrailova"
25649,Kim Ki-duk,"Cho Jae-hyun, Seo Won, Kim Yun-tae"
14863,Don E. FauntLeRoy,"David Hasselhoff, Crystal Allen, John Rhys-Davies"
440472,Neil Burger,"Kevin Hart, Bryan Cranston, Nicole Kidman"
385103,Tony Cervone,"Will Forte, Frank Welker, Mark Wahlberg"
11613,Bruno Corbucci,"Bud Spencer, Tomas Milian, Marc Lawrence"
10665,Bryan Bertino,"Liv Tyler, Scott Speedman, Gemma Ward"
381341,Paolo Genovese,"Giuseppe Battiston, Anna Foglietta, Marco Giallini"
434761,John Gray,"Annabeth Gish, John Terlesky, Kevin Dillon"
487616,Lou Jeunet,"Noémie Merlant, Niels Schneider, Benjamin Lavernhe"
628917,Brandon Trost,"Seth Rogen, Sarah Snook, Molly Evensen"
929,Roland Emmerich,"Matthew Broderick, Jean Reno, Maria Pitillo"
9904,Steve Williams,"Kiefer Sutherland, Jim Belushi, Eddie Izzard"
1234601,Ben Russell,
41240,Anjelica Huston,"Jennifer Jason Leigh, Ron Eldard, Glenne Headly"
333348,Jessie Nelson,"Diane Keaton, John Goodman, Ed Helms"
155242,Alberto Mariscal,"Vicente Fernández, Narciso Busquets, Patricia Aspíllaga"
12120,Richard Benjamin,"Dan Aykroyd, Kim Basinger, Jon Lovitz"
116005,Scud,"Osman Hung, Linda So, Haze Leung"
1141228,Andrew Renzi,"Jake Paul, Logan Paul, Greg Paul"
428045,Oleg Stepchenko,"Jason Flemyng, Jackie Chan, Charles Dance"
829361,Vardan Tozija,"Matej Sivakov, Saško Kocev, Aleksandar Ničovski"
1027330,T.W. Peacocke,"Lori Loughlin, James Tupper, Darrin Baker"
884,David Cronenberg,"James Spader, Holly Hunter, Elias Koteas"
11005,Penny Marshall,"Robert De Niro, Robin Williams, John Heard"
347969,Frank Coraci,"Adam Sandler, Terry Crews, Jorge Garcia"
37100,Kunihiko Ikuhara,"Kotono Mitsuishi, Toru Furuya, Michie Tomizawa"
332356,Christopher Menaul,"Haaz Sleiman, Eoin Macken, Emmanuelle Chriqui"
715931,Antoine Fuqua,"Will Smith, Ben Foster, Charmaine Bingwa"
523781,Thor Freudenthal,"Charlie Plummer, Molly Parker, Walton Goggins"
793,David Lynch,"Isabella Rossellini, Kyle MacLachlan, Dennis Hopper"
610253,David Gordon Green,"Jamie Lee Curtis, Judy Greer, Andi Matichak"
1673,Budd Boetticher,"Randolph Scott, Nancy Gates, Claude Akins"
350312,S. S. Rajamouli,"Prabhas, Rana Daggubati, Anushka Shetty"
837881,Maria Schrader,"Zoe Kazan, Carey Mulligan, Patricia Clarkson"
245700,Mike Leigh,"Timothy Spall, Dorothy Atkinson, Marion Bailey"
157843,Werner Herzog,"Nicole Kidman, James Franco, Damian Lewis"
927547,Payal Kapadia,"Kani Kusruti, Divya Prabha, Chhaya Kadam"
11284,Rachel Talalay,"Robert Englund, Lisa Zane, Shon Greenblatt"
15927,David Lean,"Judy Davis, Victor Banerjee, Peggy Ashcroft"
504903,Jo Tae-ho,"Kim Hee-jeong, Kim Ji-yeon, Jin Joo"
10925,Dan O'Bannon,"Clu Gulager, James Karen, Don Calfa"
177,Terry Gilliam,"Robin Williams, Jeff Bridges, Amanda Plummer"
10294,Nimród Antal,"Kate Beckinsale, Luke Wilson, Frank Whaley"
872976,Tomohisa Taguchi,"Fukujuro Katayama, Junko Noda, Arthur Lounsbery"
11319,Art Stevens,"Bob Newhart, Eva Gabor, Geraldine Page"
12262,Wes Craven,"Susan Lanier-Bramlett, Robert Houston, Martin Speer"
1358147,Joshua Rimmer,"Dante Monteverde, Yimlisüngküm Longchari, Ryan Garozzo"
1333175,,Miru Sakamichi
10414,Stephen Herek,"Emilio Estevez, Joss Ackland, Lane Smith"
33613,Daniel Alfredson,"Michael Nyqvist, Noomi Rapace, Lena Endre"
83090,Kōzō Morishita,"Toru Furuya, Hirotaka Suzuoki, Hideyuki Hori"
633604,Lars Damoiseaux,"Maaike Neuville, Bart Hollanders, Benjamin Ramon"
1370577,Nathalie Masduraud,Noémie Merlant
33320,Satoshi Kon,"Miyoko Shoji, Mami Koyama, Fumiko Orikasa"
57084,Gilberto Martínez Solares,"Cecilia Pezet, Enrique Rocha, Delia Magaña"
51533,Jiang Wen,"Jiang Wen, Chow Yun-Fat, Ge You"
280217,Mike Mitchell,"Chris Pratt, Elizabeth Banks, Will Arnett"
44826,Martin Scorsese,"Asa Butterfield, Ben Kingsley, Chloë Grace Moretz"
391713,Greta Gerwig,"Saoirse Ronan, Laurie Metcalf, Tracy Letts"
13805,Aaron Seltzer,"Matt Lanter, Vanessa Lachey, Gary 'G. Thang' Johnson"
303,Alfred Hitchcock,"Cary Grant, Ingrid Bergman, Claude Rains"
82074,Giuliano Carnimeo,"Renzo Montagnani, Carmen Russo, Cinzia de Ponti"
91417,Tom Owens,"Jay Baruchel, Gerard Butler, Craig Ferguson"
477776,Goro Taniguchi,"Jun Fukuyama, Sayaka Ohara, Yukana"
1149791,Girish A D,"Naslen, Mamitha Baiju, Sangeeth Prathap"
931954,Jaume Balagueró,"Ester Expósito, Ángela Cremonte, Inés Fernández"
454992,Susanna Fogel,"Mila Kunis, Kate McKinnon, Justin Theroux"
25137,Peter Hyams,"Jesse Metcalfe, Amber Tamblyn, Michael Douglas"
301502,Andrew Dominik,"Ana de Armas, Adrien Brody, Bobby Cannavale"
254672,Law Wing-Cheong,"Xing Yu, Zhang Yamei, Steve Yoo"
1561,Robert Bresson,"Nadine Nortier, Jean-Claude Guilbert, Marie Cardinal"
798362,Neil Burger,"Daisy Ridley, Ben Mendelsohn, Garrett Hedlund"
9762,Anne Fletcher,"Channing Tatum, Jenna Dewan, Damaine Radcliff"
49849,Jon Favreau,"Daniel Craig, Harrison Ford, Olivia Wilde"
11476,Hardy Martins,"Bernhard Bettermann, Michael Mendl, Anatoliy Kotenyov"
662237,Lee Kae-byeok,"Jang Ki-yong, Chae Soo-bin, Krystal Jung"
1061181,Shinsuke Sato,"Kento Yamazaki, Ryo Yoshizawa, Kanna Hashimoto"
1016848,Max Eggers,"Brandy Norwood, Andrew Burnap, Kathryn Hunter"
127533,Keishi Otomo,"Takeru Satoh, Emi Takei, Koji Kikkawa"
5375,David Dobkin,"Vince Vaughn, Paul Giamatti, John Michael Higgins"
68734,Ben Affleck,"Ben Affleck, Bryan Cranston, Alan Arkin"
988591,David Gregory,"May Kelly, Kelly Rian Sanson, Gillian Broderick"
556574,Thomas Kail,"Lin-Manuel Miranda, Leslie Odom Jr., Renée Elise Goldsberry"
15213,Christopher Reeve,"William H. Macy, Rob Reiner, Brian Dennehy"
8265,Dany Boon,"Kad Merad, Dany Boon, Zoé Félix"
250225,Peter Strickland,"Sidse Babett Knudsen, Chiara D'Anna, Eugenia Caruso"
9647,Richard Donner,"Bill Murray, Karen Allen, John Forsythe"
418078,Trey Edward Shults,"Joel Edgerton, Christopher Abbott, Carmen Ejogo"
717132,Choi Woo-seong,"Han Ga-in, Kim Ji-ah, James"
1155090,Patrick Michael Ryder,"Richard Brake, Andrew-Lee Potts, Bill Fellows"
451915,Felix van Groeningen,"Steve Carell, Timothée Chalamet, Maura Tierney"
109431,Seth Gordon,"Jason Bateman, Melissa McCarthy, Jon Favreau"
447200,Rawson Marshall Thurber,"Dwayne Johnson, Neve Campbell, Chin Han"
333596,Jon Erwin,"C. Thomas Howell, Sean Astin, Jon Voight"
604362,Choi Won-sub,"Kwon Sang-woo, Jeong Jun-ho, Hwang Woo-seul-hye"
617882,Min Yong-keun,"Kim Da-mi, Jeon So-nee, Byeon Woo-seok"
8374,Troy Duffy,"Willem Dafoe, Sean Patrick Flanery, Norman Reedus"
15849,Karl Freund,"Boris Karloff, Zita Johann, David Manners"
4553,Brad Anderson,"Christian Bale, Jennifer Jason Leigh, Aitana Sánchez-Gijón"
926008,Kristin Gore,"Zach Galifianakis, Elizabeth Banks, Sarah Snook"
342878,Jean-François Richet,"Vincent Cassel, François Cluzet, Alice Isaaz"
72213,Alex Kendrick,"Ken Bevel, Alex Kendrick, Kevin Downes"
1852,Oliver Stone,"Nicolas Cage, Michael Peña, Maria Bello"
761053,Tosca Musk,"Melanie Zanetti, Giulio Berruti, Rhett Wellington Ramirez"
157098,Shōgorō Nishimura,"Ran Masaki, Rena Kuroki, Ryûichi Yabuki"
644495,Ridley Scott,"Lady Gaga, Adam Driver, Al Pacino"
351460,Adam Wingard,"Nat Wolff, LaKeith Stanfield, Margaret Qualley"
26275,Tetsuya Nakashima,"Kyoko Fukada, Anna Tsuchiya, Hiroyuki Miyasako"
830721,Thaddeus O'Sullivan,"Maggie Smith, Laura Linney, Kathy Bates"
2642,Marc Lawrence,"Sandra Bullock, Hugh Grant, Dana Ivey"
1219735,Santiago Mohar Volkow,"Andrew Leland Rogers, Lucía Gómez-Robledo, Mónica del Carmen"
1024535,Ben Steiner,"Jemima Rooper, Kate Dickie, Sarah Paul"
386861,Won Seok-ho,"Kwon Hae-sung, Kang Eun-hye, Lee Eun-mi"
921360,Matt Eskandari,"Kevin Dillon, Bruce Willis, Oliver Trevena"
24478,David Mickey Evans,"Judge Reinhold, Julia Sweeney, Joe Pichler"
1010730,Brian Brough,"Sashleigha Hightower, Chris Reid, Tanner Gillman"
10246,Bob Clark,"Dan Monahan, Mark Herrier, Wyatt Knight"
1262034,Carole Bianic,"Ophélia Kolb, Ariane Séguillon, Juliette Poissonnier"
257440,Peter Billingsley,"Vince Vaughn, Hailee Steinfeld, Bill Paxton"
25749,James D.R. Hickox,"Daniel Cerny, Ron Melendez, Jim Metzler"
10336,Mark A.Z. Dippé,"Michael Jai White, Martin Sheen, John Leguizamo"
16437,Michael Schroeder,"Elias Koteas, Angelina Jolie, Jack Palance"
859,Stephen Frears,"Glenn Close, John Malkovich, Michelle Pfeiffer"
1675,François Truffaut,"Jacqueline Bisset, Jean-Pierre Léaud, François Truffaut"
26515,Stan Winston,"Lance Henriksen, Jeff East, John D'Aquino"
2832,James Mangold,"John Cusack, Ray Liotta, Amanda Peet"
15143,Howard Deutch,"Eric Stoltz, Mary Stuart Masterson, Lea Thompson"
33518,Lewis Teague,"Robert Forster, Robin Riker, Michael V. Gazzo"
238215,Tom McCarthy,"Adam Sandler, Method Man, Dustin Hoffman"
9530,Barry Sonnenfeld,"Robin Williams, Cheryl Hines, JoJo"
9264,Katt Shea,"Drew Barrymore, Sara Gilbert, Tom Skerritt"
1627,François Truffaut,"Jean-Pierre Cargol, François Truffaut, Françoise Seigner"
527261,John R. Leonetti,"Stanley Tucci, Kiernan Shipka, Miranda Otto"
421467,Koji Hashimoto,"Keiju Kobayashi, Ken Tanaka, Yasuko Sawaguchi"
12593,Ralph Bakshi,"Skip Hinnant, Rosetta LeNoire, John McCurry"
9486,Peter Howitt,"Rowan Atkinson, Natalie Imbruglia, Ben Miller"
1321413,Rodolphe Marconi,
1714,François Truffaut,"Julie Christie, Oskar Werner, Cyril Cusack"
465078,Neill Blomkamp,"Sharlto Copley, Jason Cope"
156700,Jordan Vogt-Roberts,"Nick Robinson, Gabriel Basso, Moisés Arias"
728754,Takashi Yamazaki,"Wasabi Mizuta, Megumi Oohara, Yumi Kakazu"
556694,George Miller,"Tilda Swinton, Idris Elba, Erdil Yaşaroğlu"
339103,Kevin Connolly,"John Travolta, Spencer Rocco Lofranco, Kelly Preston"
740985,Jason Woliner,"Sacha Baron Cohen, Maria Bakalova, Tom Hanks"
611698,Lu Yang,"Lei Jiayin, Yang Mi, Dong Zijian"
270413,Takashi Hashimoto,"Naoto Takenaka, Chikao Ohtsuka, Mayumi Tanaka"
728142,Uberto Pasolini,"James Norton, Daniel Lamont, Eileen O'Higgins"
16093,Herk Harvey,"Candace Hilligoss, Herk Harvey, Sidney Berger"
581734,Chloé Zhao,"Frances McDormand, David Strathairn, Linda May"
111969,Josh Boone,"Greg Kinnear, Jennifer Connelly, Lily Collins"
1272,Danny Boyle,"Cillian Murphy, Rose Byrne, Chris Evans"
1030613,André van Duren,"Bracha van Doesburgh, Elise Schaap, Gijs Naber"
167305,Michael Greenspan,"Katie Cassidy, Tracy Spiridakos, Donal Logue"
267805,Alfonso Pineda Ulloa,"José María Yázpik, Shannyn Sossamon, Tommy Flanagan"
964960,Trần Anh Hùng,"Benoît Magimel, Juliette Binoche, Patrick d'Assumçao"
1008102,Ross Venokur,"Jimmy O. Yang, Lisa Lu, Chloe Bennet"
161715,Tsutomu Shibayama,"Nobuyo Oyama, Noriko Ohara, Michiko Nomura"
15895,James Sbardellati,"Rick Hill, Barbi Benton, Richard Brooker"
811592,James Nunn,"Scott Adkins, Ashley Greene, Ryan Phillippe"
271467,Nick Cannon,"Patrick Warburton, Wilmer Valderrama, Efren Ramirez"
15097,Alain Berbérian,"Chantal Lauby, Alain Chabat, Dominique Farrugia"
336455,Henry Joost,"Sofia Black-D'Elia, Lio Tipton, Travis Tope"
11238,Tad Stones,"Val Bettin, Jim Cummings, Gilbert Gottfried"
26388,Rodrigo Cortés,"Ryan Reynolds, José Luis García Pérez, Robert Paterson"
475,Arthur Penn,"Warren Beatty, Faye Dunaway, Michael J. Pollard"
1011082,Ned Benson,"Lucy Boynton, Justin H. Min, David Corenswet"
1384369,Amábily Lopes,"Tuka Porto, Estefânia Lima, Diego Machado"
2330,Gérard Pirès,"Samy Naceri, Frédéric Diefenthal, Marion Cotillard"
256474,John Stockwell,"Gina Carano, Cam Gigandet, Luis Guzmán"
253450,Hou Hsiao-hsien,"Shu Qi, Chang Chen, Nikki Hsieh"
14537,Masaki Kobayashi,"Tatsuya Nakadai, Akira Ishihama, Shima Iwashita"
415312,Richard Schenkman,"David Lee Smith, Vanessa Williams, Michael Dorn"
870360,Peter Browngardt,"Eric Bauza, Candi Milo, Peter MacNicol"
183443,Eric Radomski,"Kate Higgins, Salli Saffioti, Debi Derryberry"
486131,Tim Story,"Samuel L. Jackson, Jessie T. Usher, Regina Hall"
52333,Wagner de Assis,"Renato Prieto, Fernando Alves Pinto, Rosanne Mulholland"
253278,Wellson Chin Sing-Wai,"Sibelle Hu Hui-Chung, Sandra Ng Kwan-Yue, Amy Yip Chi-Mei"
40205,Peter DeLuise,"Debby Ryan, Jean-Luc Bilodeau, Anna Mae Wills"
700,John Glen,"Roger Moore, Maud Adams, Louis Jourdan"
553604,Mark Williams,"Liam Neeson, Kate Walsh, Jai Courtney"
157354,Ryan Coogler,"Michael B. Jordan, Melonie Diaz, Octavia Spencer"
995746,Stéphanie Di Giusto,"Nadia Tereszkiewicz, Benoît Magimel, Benjamin Biolay"
146301,Gregory Plotkin,"Chris J. Murray, Brit Shaw, Ivy George"
151586,Nello Rossati,"Francesca Muzio, Orchidea De Santis, Annie Carol Edel"
31011,Jaco Van Dormael,"Jared Leto, Sarah Polley, Diane Kruger"
1172562,Hur Jang,"Lim Hoo-seong, Lee Su-jeong, Lee Do-jin"
800937,Alex Hardcastle,"Rebel Wilson, Sam Richardson, Zoë Chao"
248561,Jason Hull,"Bill Oberst Jr., Samantha Hoepfl, Erica Soto"
25508,Jacques Tourneur,"Simone Simon, Kent Smith, Tom Conway"
42994,Katsuhiro Otomo,"Tsutomu Isobe, Koichi Yamadera, Shozo Iizuka"
7350,Rob Reiner,"Jack Nicholson, Morgan Freeman, Sean Hayes"
1032948,Natasha Kermani,"Alex Galick, Anna Sundberg, Chelsey Grant"
1147114,Jeanne Gottesdiener,"Didier Bourdon, Noémie Lvovsky, Jules Sagot"
12448,Bradley Raymond,"Tom Hulce, Jennifer Love Hewitt, Jason Alexander"
655,Wim Wenders,"Harry Dean Stanton, Nastassja Kinski, Dean Stockwell"
945729,Kenneth Branagh,"Kenneth Branagh, Kyle Allen, Camille Cottin"
1093966,T. J. Gnanavel,"Rajinikanth, Amitabh Bachchan, Fahadh Faasil"
33909,Oliver Stone,"Michael Douglas, Shia LaBeouf, Josh Brolin"
1721,Giuseppe Colizzi,"Terence Hill, Bud Spencer, Reinhard Kolldehoff"
1025491,Matt Brown,"Anthony Hopkins, Matthew Goode, Liv Lisa Fries"
1313007,Paulo Córdova,"Gloria Gordillo, Alexis Tenorio, Luna Blanco"
253235,Rob Reiner,"Michael Douglas, Diane Keaton, Sterling Jerins"
9947,Rob Bowman,"Jennifer Garner, Goran Višnjić, Will Yun Lee"
9889,Peter Farrelly,"Jack Black, Gwyneth Paltrow, Jason Alexander"
638449,Augustine Frizzell,"Shailene Woodley, Felicity Jones, Callum Turner"
1367565,Donato Rotunno,
40172,Masashi Yamamoto,"Sora Aoi, Shou Nishino, Keita Ôno"
246080,Kevin Macdonald,"Jude Law, Karl Davies, Jodie Whittaker"
340670,Masaru Konuma,"Reiko Sai, Saeko Kizuki, Kōjirō Kusanagi"
26502,Budd Boetticher,"Randolph Scott, Gail Russell, Lee Marvin"
597219,Alice Wu,"Leah Lewis, Daniel Diemer, Alexxis Lemire"
16858,Bob Fosse,"Roy Scheider, Ann Reinking, Leland Palmer"
2005,Emile Ardolino,"Whoopi Goldberg, Maggie Smith, Kathy Najimy"
1374717,Adilkhan Yerzhanov,"Berik Aitzhanov, Anna Starchenko, Kuantay Abdimadi"
24873,Michael Winner,"Charles Bronson, Deborah Raffin, Ed Lauter"
16769,Michael Apted,"Sissy Spacek, Tommy Lee Jones, Levon Helm"
1001865,Stephen Donnelly,"Luke Evans, Olivia Colman, Jessie Buckley"
192141,John Erick Dowdle,"Owen Wilson, Lake Bell, Pierce Brosnan"
387893,Ricardo Curtis,"Ray Romano, John Leguizamo, Denis Leary"
1260594,Rizal Mantovani,"Luna Maya, Darius Sinathrya, Makayla Rose Hilli"
9539,Pascal Laugier,"Morjana Alaoui, Mylène Jampanoï, Catherine Bégin"
458353,Dean McKendrick,"Carter Cruise, Brent Harvey, Mia Li"
113947,Ben Lewin,"John Hawkes, Helen Hunt, William H. Macy"
9350,Renny Harlin,"Sylvester Stallone, John Lithgow, Michael Rooker"
11354,Mike Binder,"Joan Allen, Kevin Costner, Erika Christensen"
10212,Antonia Bird,"Guy Pearce, Robert Carlyle, David Arquette"
16263,Alan Metter,"Sarah Jessica Parker, Helen Hunt, Shannen Doherty"
16028,Robert Harmon,"Laura Regan, Marc Blucas, Ethan Embry"
611716,Wataru Takeishi,"Hikaru Utada, Naoki Matayoshi"
15338,David Mickey Evans,"Josh Flitter, Emma Lockhart, Ann Cusack"
59709,Brian Trenchard-Smith,"Amanda Ryan, Edward Atterton, Jacqueline Bisset"
6557,Anne Fletcher,"Katherine Heigl, James Marsden, Malin Åkerman"
1370584,Deirdre Fishel,
10069,William Brent Bell,"Jon Foster, Samaire Armstrong, Frankie Muniz"
26736,Lev L. Spiro,"Selena Gomez, Jake T. Austin, David Henrie"
1000173,Mélanie Delloye-Betancourt,"Zara Devlin, Eoin Duffy, Mark Huberman"
257117,Madellaine Paxson,"Milo Cawthorne, Olivia Tennet, Ari Boyland"
15393,Clint Eastwood,"Clint Eastwood, Jessica Walter, Donna Mills"
1369907,Jacques Naudé,
269495,Samuli Valkama,"Anu Sinisalo, Ville Virtanen, Wanda Dubiel"
824016,Roman Polanski,"Oliver Masucci, Fanny Ardant, John Cleese"
15706,Todd Stephens,"Jonah Blechman, Jake Mosser, Aaron Michael Davies"
25623,Nobuhiko Obayashi,"Kimiko Ikegami, Kumiko Ohba, Ai Matsubara"
1160956,Zhang Luan,"Jackie Chan, Wei Xiang, Han Yanbo"
158426,David Marconi,"Roschdy Zem, Jaimie Alexander, Frank Grillo"
19101,Alfonso Cuarón,"Liesel Matthews, Eleanor Bron, Liam Cunningham"
791348,Matt Peters,"Matt Ryan, Ray Chase, Robin Atkin Downes"
11532,John Boorman,"Powers Boothe, Charley Boorman, Meg Foster"
11007,Shawn Levy,"Steve Martin, Bonnie Hunt, Piper Perabo"
255798,Joe Dante,"Anton Yelchin, Ashley Greene, Alexandra Daddario"
12219,William Friedkin,"Courtney B. Vance, Ossie Davis, George C. Scott"
41515,Eric Brevig,"Dan Aykroyd, Justin Timberlake, Anna Faris"
271709,Masamitsu Hidaka,"Mamoru Miyano, Yuichi Nakamura, Daisuke Ono"
28118,Max Lang,"Helena Bonham Carter, Rob Brydon, Robbie Coltrane"
47931,José Padilha,"Wagner Moura, Irandhir Santos, André Ramiro"
16790,Matthew Robbins,"Cindy Williams, David Rasche, Suzie Plakson"
943,Richard Donner,"Mel Gibson, Danny Glover, Joe Pesci"
596015,Leandro Bartoletti,"Gastón Pauls, Osmar Núñez, Rolando Graña"
25706,Albert Pyun,"Andrew Dice Clay, Teri Hatcher, Yuji Okumoto"
10780,Garry Marshall,"Goldie Hawn, Kurt Russell, Edward Herrmann"
849236,Igor Zaytsev,"Sergei Bezrukov, Aram Vardevanyan, Aleksandr Tsekalo"
818893,Aleksey Chadov,"Aleksey Chadov, Kristina Asmus, Viktor Sukhorukov"
408586,,Hikaru Utada
114155,Richard Laxton,"Dakota Fanning, Emma Thompson, Greg Wise"
25166,Nick Gomez,"Danny DeVito, Bette Midler, Neve Campbell"
11502,Roman Polanski,"Leon Niemczyk, Jolanta Umecka, Zygmunt Malanowicz"
2577,Michael Winterbottom,"Tim Robbins, Samantha Morton, Nabil Elouahabi"
1150573,Nuel C. Naval,"Sharon Cuneta, Alden Richards, Miles Ocampo"
40652,Jean-Luc Godard,"Macha Méril, Bernard Noël, Philippe Leroy"
11044,Emir Kusturica,"Johnny Depp, Jerry Lewis, Faye Dunaway"
227306,Angelina Jolie,"Jack O'Connell, Alex Russell, Domhnall Gleeson"
11023,Catherine Hardwicke,"Evan Rachel Wood, Nikki Reed, Holly Hunter"
2331,Roger Young,"Jeremy Sisto, Debra Messing, Jacqueline Bisset"
171587,Byun Sung-hyun,"Kim A-joong, Ji Sung, Shin So-yul"
22586,Richard Rich,"Jack Palance, Howard McGillin, Michelle Nicastro"
15265,Albert Lamorisse,"Pascal Lamorisse, Georges Sellier, Vladimir Popov"
721656,Maxwell Atoms,"Frank Welker, Grey DeLisle, Matthew Lillard"
704440,Kong Ja-kwan,"Yoo Jung, Kang Min-woo, Yoon So-jung"
25330,Peter Faiman,"Ed O'Neill, Ethan Embry, JoBeth Williams"
17343,Jesús Franco,"Soledad Miranda, Ewa Strömberg, Dennis Price"
184125,Uwe Boll,"Dominic Purcell, Erin Karpluk, Edward Furlong"
17007,Peter Werner,"Whoopi Goldberg, Nigel Hawthorne, Victor Garber"
11519,Steven Spielberg,"Dan Aykroyd, Ned Beatty, John Belushi"
6878,Duwayne Dunham,"Michael J. Fox, Sally Field, Don Ameche"
162903,Bill Condon,"Benedict Cumberbatch, Daniel Brühl, Anthony Mackie"
36576,Blake Edwards,"David Niven, Robert Wagner, Herbert Lom"
216919,Antonio Zavala Kugler,"Edith González, Christian Bach, Paola Nuñez"
41473,Takashi Ishii,"Aya Sugimoto, Fujiko, Mieko Arai"
25167,George Sidney,"Janet Leigh, Dick Van Dyke, Ann-Margret"
606625,Will Wernick,"Keegan Allen, Holland Roden, Denzel Whitaker"
408866,Yuji Shimomura,"Tak Sakaguchi, Yura Kondo, Takumi Saitoh"
16406,Andrew Fleming,"Kirsten Dunst, Michelle Williams, Dan Hedaya"
13078,David Ross,"John Leguizamo, Katherine Waterston, Cynthia Nixon"
26877,Clarence Ford,"Chingmy Yau Suk-Ching, Simon Yam, Carrie Ng Ka-Lai"
251768,Giancarlo Volpe,"Diedrich Bader, Laura Bailey, Dante Basco"
163772,Soichi Masui,"Akiko Yajima, Miki Narahashi, Keiji Fujiwara"
10741,Emilio Estevez,"Anthony Hopkins, William H. Macy, Harry Belafonte"
283587,Cary Joji Fukunaga,"Abraham Attah, Idris Elba, Emmanuel Nii Adom Quaye"
26550,Mimmo Cattarinich,"Pierre Clémenti, Katya Berger, Ugo Bologna"
9522,David Dobkin,"Owen Wilson, Vince Vaughn, Christopher Walken"
1295638,,
17043,John Stainton,"Steve Irwin, Terri Irwin, Magda Szubanski"
155890,Hélène Fillières,"Benoît Poelvoorde, Laetitia Casta, Richard Bohringer"
1263112,Herwin Novianto,"Vino G. Bastian, Marsha Timothy, Indro"
254027,Peng Haitao,
10730,John Guillermin,"Jeff Bridges, Jessica Lange, Charles Grodin"
907,David Lean,"Omar Sharif, Julie Christie, Geraldine Chaplin"
9641,Adam Shankman,"Steve Martin, Eugene Levy, Bonnie Hunt"
25898,Charley Rogers,"Stan Laurel, Oliver Hardy, Henry Brandon"
448119,Stephen Gaghan,"Robert Downey Jr., Harry Collett, Michael Sheen"
875104,Zhang Zhulin,"Xie Miao, Chen Guanying, Sergio De Ieso"
720557,Maneesh Sharma,"Salman Khan, Katrina Kaif, Emraan Hashmi"
9429,John Fortenberry,"Chris Kattan, Will Ferrell, Dan Hedaya"
431530,Scott Moore,"Mila Kunis, Kristen Bell, Kathryn Hahn"
9954,Renny Harlin,"Steven Strait, Sebastian Stan, Laura Ramsey"
49022,Luke Greenfield,"Ginnifer Goodwin, Kate Hudson, Colin Egglesfield"
11578,Julien Duvivier,"Fernandel, Gino Cervi, Arturo Bragaglia"
25684,Bob Bralver,"David Bradley, Lee Reyes, Anne Dupont"
957,Mel Brooks,"Mel Brooks, John Candy, Rick Moranis"
623491,McG,"Judah Lewis, Samara Weaving, Jenna Ortega"
9268,Chuck Russell,"Arnold Schwarzenegger, Vanessa Williams, James Caan"
993867,Daniel Byers,"Awni Abdi-Bahri, Christian Masters, Harry Aspinwall"
6972,Baz Luhrmann,"Nicole Kidman, Hugh Jackman, Essie Davis"
1027938,Sophia Bösch,"Mathilde Bundschuh, Susanne Wolff, Ulrich Matthes"
9798,Tony Scott,"Will Smith, Gene Hackman, Jon Voight"
207932,Ron Howard,"Tom Hanks, Felicity Jones, Omar Sy"
5968,Gene Wilder,"Gene Wilder, Charles Grodin, Joseph Bologna"
108954,Huo Jianqi,"Teng Ru-jun, Ye Liu, Chen Hao"
17464,Sam Firstenberg,"Lucinda Dickey, Adolfo Quinones, Michael Chambers"
83389,Goro Miyazaki,"Masami Nagasawa, Junichi Okada, Keiko Takeshita"
85350,Richard Linklater,"Ellar Coltrane, Patricia Arquette, Ethan Hawke"
1139236,Jacqueline van Vugt,"Hadewych Minis, Gijs Naber, Karim Saidi"
11374,Ron Howard,"Matthew McConaughey, Woody Harrelson, Sally Kirkland"
107985,Edgar Wright,"Simon Pegg, Nick Frost, Paddy Considine"
1082063,Gabriel Abrantes,"Brigette Lundy-Paine, Carloto Cotta, Anabela Moreira"
21448,Bobs Gannaway,"Wayne Allwine, Tony Anselmo, Bill Farmer"
282070,Takashi Yamazaki,"Shota Sometani, Ai Hashimoto, Sadawo Abe"
592863,Liesl Tommy,"Jennifer Hudson, Forest Whitaker, Marlon Wayans"
244566,Jeff Baena,"Aubrey Plaza, Dane DeHaan, John C. Reilly"
668,Peter R. Hunt,"George Lazenby, Diana Rigg, Telly Savalas"
17927,Will Gluck,"Nicholas D'Agosto, Eric Christian Olsen, Sarah Roemer"
2087,Roger Donaldson,"Alec Baldwin, Kim Basinger, Michael Madsen"
571891,Motonori Sakakibara,"Rica Matsumoto, Ikue Otani, Mayumi Izuka"
17077,Jan Troell,"Maria Heiskanen, Mikael Persbrandt, Jesper Christensen"
587301,Mehdi Idir,"Zita Hanrot, Liam Pierron, Soufiane Guerrab"
18009,Rodman Flender,"Warwick Davis, Charlie Heath, Shevonne Durkin"
264999,Gregory Jacobs,"Channing Tatum, Matt Bomer, Joe Manganiello"
389015,Craig Gillespie,"Margot Robbie, Sebastian Stan, Allison Janney"
282813,Grégory Levasseur,"Ashley Grace, Denis O'Hare, James Buckley"
16323,Mark Rydell,"Bette Midler, Alan Bates, Frederic Forrest"
826,David Lean,"William Holden, Alec Guinness, Jack Hawkins"
1039882,Kim Hee-jin,"Song Joong-ki, Choi Sung-eun, Waël Sersoub"
245473,Paul Hoen,"Luke Benward, Dove Cameron, Mike C. Manning"
487242,Sam Liu,"Christian Slater, Tara Strong, Billy Brown"
